video_id,transcricao
H3Mc4126A2s,E aí e vai já Vimos que cultura é um conjunto complexo que inclui conhecimentos danças crenças costumes culinária arte arquitetura religião moral leis e qualquer outra capacidade ou hábitos adquiridos pela humanidade enquanto membro de uma sociedade Apesar dessa definição existem diferentes Olhares Sobre a cultura o antropólogo britânico Edward Tailor via cultura de um ponto de vista evolucionista entendia que cada sociedade estava no ponto evolutivo diferente e que a cultura seria o resultado desse processo constante saindo do menos de desenvolvido para o mais desenvolvido o problema dessa concepção é que permitiu que algumas pessoas considerassem que uns são superiores aos outros e o antropólogo ou estadunidense Franz boas criticavam a visão de Tailor pois sabia que a evolução ao contrário da visão do senso comum não é um processo linear e as diferentes culturas não estão em estágios evolutivos diferentes na verdade suas histórias transcorrem lado a lado não existem caminhos para estabelecidos nem evolução cada sociedade e cultura vai transcorrer o seu próprio caminho portanto os percursos são diferenciados e construídos historicamente na especificidade de cada uma delas pela visão de boas não a linha de chegada a ser atingida dizer que uma civilização é selvagem ou mal desenvolvida e a outra é excelente diz mais respeito a quem está falando do que a própria civilização esse essa visão ao respeitar a particularidade Histórica de cada lugar permite repensar sobre as desigualdades sociais econômicas que atingem as diferentes sociedades e culturas E aí E aí [Música] e em resumo enquanto Tailor criou uma visão de cultura que permite a hierarquia entre as sociedades boas defendia que cada cultura tem uma história particular e para compreendê-la é preciso reconstruir a sua história e com isso encerramos o vídeo de hoje se achar necessário ter veja continue estudando e pesquisando sobre o assunto e até a próxima a
Y_befLlahys,"[Aplausos] [Música] Abemos papa Tá todo mundo aí falando do novo papa e a gente aqui ficou muito curioso para saber como é que eles fazem aquela fumaça que uma hora sai preta e a outra hora sai branca Alguns jornais até chegaram a divulgar como é que é feito, qual é que é a fórmula, mas eu não vi ninguém reproduzindo essas duas fumaças direito, não Então hoje a gente vai reproduzir as fumaças do Vaticano aqui na nossa capela cistina [Música] Acabou de ser eleito o novo papa para quem tava viajando na lua em Marte, sei lá Ele é o cardeal Robert Francis Prevost, tem 69 anos Ele é o primeiro papa que veio dos Estados Unidos, mas atuou no Peru Não vou ficar dando detalhes de como é feita essa eleição, mas ela acontece dentro da Capela Cistina que fica ali no Vaticano Ela é aquela igreja que o Michelângelo pintou todo o teto Como não tem ninguém filmando, fazendo live lá de dentro, para anunciar o resultado, eles queimam as cédulas e sai uma fumacinha por uma chaminé que fica ali em cima da capela Se ela for preta, é porque eles ainda não conseguiram chegar num resultado Se ela sair branca, é porque foi eleito o novo papo Será que foi daí que tiraram a ideia de chá revelação Mas o mais importante, o que decide a cor da fumaça é pura química O próprio Vaticano divulgou a fórmula da fumaça Olha lá A preta é perclorato de potássio, antraceno e enxofre E a branca é clorato de potássio, lactose e resina Assim que eu li o nome desses ingredientes, eu corri lá para um quartinho, fi, aqui no fundo do Manual do Mundo, onde a gente guarda os ingredientes de química Aí eu comecei a achar coisa que tava lá fazia uns 12 anos mais ou menos E achei quase tudo para formar essas fumaças O perclorato e o clorato de potássio servem para fornecer oxigênio pra queima A gente não tinha, mas vamos usar nitrato de potássio, que também serve e é mais fácil de encontrar Ele é bastante usado em fertilizantes O antraceno é bem parecido com o naftaleno, que nada mais é do que naftalina Por causa do formato da molécula, a gente diz que eles tm anéis aromáticos A naftalina é meio tóxica, então a gente vai ter que usar máscara Resina é a mesma coisa que breu E isso a gente tinha bastante porque uma vez a gente tentou fazer uma bola perfeita que não deu certo É a seiva da árvore Isso aqui é um breu de pinos, tem um cheiro bem gostoso Enxofre a gente também tinha Eu acho que eu nunca usei para nada Tá na classe daquelas coisas que a gente compra aqui no Manual do Mundo para um dia usar e chega uma hora que a gente usa mesmo E a lactose pura a gente não tinha, mas é uma das coisas que tá no leite em pó, então ele vai substituir com louvor a lactose nessa fórmula Quem nunca mudou uns ingredientes na receita que atilha a primeira pedra Antes de separar os ingredientes, eu vou montar o nosso forninho Isso aqui é uma chaminé de churrasqueira que opa, vou cair da escada, que ultimamente a gente estava usando pra ser a saída do corte a laser Então, a gente desconectou e embaixo eu vou colocar esse forninho que nada mais é do que um bujãozinho de gás que o Gu Toledo deixou aqui da última vez que ele veio me ensinar a cortar coisas com plasma Então vamos montar esse forno de alta tecnologia aqui Não é por nada não, mas a nossa chaminezinha tá bem parecida com a do Vaticano, hein Queimar voto e sair fumaça é uma tradição bem antiga, mas essa coisa da fumaça sair preta ou branca é relativamente recente A primeira vez foi em 1914 Naquela época a coisa ainda não era exatamente uma fórmula química Eles queimavam palha mesmo E eu acho que a gente podia fazer um teste com palha para ver se dá certo, né Faz de conta que eu tive essa ideia agora e ninguém pensou nisso antes, né A ideia primeiro então é fazer a fumaça preta Eu vou colocar um pouco de palha E aqui vão os votos por cima [Música] Nossa, isso pega fogo muito rápido Caramba, durou 10 segundos, não deu nem tempo da gente sair correndo lá fora para ver que cor que era Agora é valendo Eu vou tentar tampar um pouco a boca do forno aqui pra queima acontecer mais devagar e formar mais fumaça preta Pode, pode mostrar a chaminineia da capela assistindá Espero que a fumaça esteja preta [Música] Eu tô aqui dentro, eu não vi nada de fumaça, mas se acha que saiu uma fumaça preta, valia aquele joinha, não valia não A fumaça branca é praticamente a mesma coisa, só que tem uma mudança aqui embaixo que é bem simples, que é botar um pouco de palha molhada Como você viu que o fogo é bem forte, eu posso molhar para valer mesmo Vamos lá Dessa vez eu também quero ver a fumaça saindo lá fora Será que sai [Música] branca E pensar que essa é só a primeira parte, hein Pelo menos aqui no nosso teste, a diferença entre a fumaça branca e a preta é muito evidente Mas não foi o que aconteceu em 1958, na eleição do Papa João 23 Saiu uma fumaça meio acinzentada e as pessoas ficaram meio perdidas ali Ninguém sabia se tinha sido escolhido o papa ou não E aí eles resolveram trocar o jeito de fazer fumaça Não existia manual do mundo na época, né Senão a gente teria feito essa fumaça aí a cor certa Mas enfim, por que que uma hora a fumaça sai preta, outra hora a fumaça sai branca O preto é carbono, é combustível que não queimou Aconteceu uma queima incompleta ali, acabou sobrando um pouco de fuligem Essa fuligem sai junto com a fumaça, não deixa a luz passar e a gente vê uma fumaça preta A fumaça branca é água mesmo, é o vapor de água que sai ali na forma gasosa Quando encontra com ar mais frio lá em cima na chaminé, ele começa a condensar e forma microgotículas de água líquida, assim como a gente tem nas nuvens Mas vamos pra fórmula moderna agora Quem faz a fumaça preta é o naftaleno, que não queima direito e acaba soltando bastante carbono A função do enxofre é ajudar a queima do antraceno, que no nosso caso é o naftaleno, que demora um pouco para queimar E o nitrato de potássio, como eu tinha explicado para vocês, ele fornece oxigênio pra [Música] queima Vamos primeiro fazer um teste pequenininho E aí, será que a gente acertou na fórmula [Música] Já acertamos três vezes, hein Vamos tentar a branca com a fórmula química Agora, a função do leite em pó e do breu também é soltar um pouco de carbono, mas não vai ser um carbono puro São algumas moléculas mais complexas com carbono e outros elementos químicos que evaporam e depois condensam, assim como acontece com a água E mais uma vez um pouquinho de nitrato de [Música] potássio Ah, branquinha, branquinha Muito legal Mas eu prometi no começo do vídeo uma fumaça lá na nossa capela Cistina Vamos aumentar um pouquinho essa [Música] receita Vamos primeiro com a fumaça preta, porque no Conclave ela sempre vem antes da branca Parou, parou, parou Só para lembrar que no próximo final de semana vai ter lançamento do grande livro de biologia e do nosso livro Mistérios do Universo em Belém e em Macapá São os últimos dois lançamentos desse primeiro semestre Tô deixando as datas aqui do lado Quem quiser saber mais sobre esses livros que estão muito legais, eu tô deixando o link aqui na descrição Fechou Eu acho que a gente trocou de pote e não funcionou, não pegou [Música] fogo Ah, rapaz, não temos papo ainda, mas a fumaça preta funcionou [Música] Agora sim, tá na hora de eleger o novo papa E se você não deu joinha, esse é o [Música] momento Agora sim [Música] Se isso aqui não vale o joinha, eu não sei o que [Aplausos] vale Me dá uma marreta, por favor, Lucas [Música] Acho que a gente exagerou um pouco no fogo Fazia bastante tempo que a gente não tinha experiência de química aqui no Manual do Mundo Então vou deixar uma playlist aqui da nossa série especial super química, que é uma experiência hardcore atrás da outra Ah"
aw9lP3WAl2o,e fala top alunos bem vindo ao canal Top aulas E hoje vamos de ciências 7º ano e tal falarmos de placas tectônicas são quatro vídeos sobre esse tema vamos número um e o tema é o movimento os continentes meus amigos o planeta terra tem um formato de esfera e essa esfera tem camadas pedaços vejamos vou dar um exemplo temos aqui uma bola de boliche e uma bola de futebol se até a tivesse uma placa única seria como uma bola de boliche mas o nosso planeta é coberto por várias placas assim como os gomos da bola de futebol Nós se amamos esses pedaços de placas tectônicas E aí parece uma bola de futebol não é mesmo as porções de terra que aparecem sobre a placa nós chamamos de continente Você sabe quantos continentes existem são seis continentes África Ásia a Oceania Europa e América então agora resolvemos um mistério temos duas dicas dica número um você já notou em um mapa que os continentes parecem se encaixar virgem que a América do Sul onde fica o Brasil EA África têm formas que se encaixam dica número 2 portas de um mesmo tipo de réptil terrestre foram encontrados na América do Sul e na África e então sabe responder esse mistério e vejamos os continentes parecem ter um encaixe quase que perfeito e fósseis de um mesmo animal já foram encontrados nos dois continentes mesmo estando separado por quilômetros e quilômetros de água Isso me lembra a uma teoria um cientista alemão propôs a ideia de um único e imenso continente chamado pangeia esse continente existiu há milhões de anos atrás em um determinado momento esse continente começou a se dividir E essas partes menores se movimentaram até formar os continentes como são hoje essa separação EA movimentação dos continentes ficou conhecida como a teoria da deriva continental esse movimento só foi possível porque a crosta da terra é formado por vários pedaços ou seja várias placas de rocha sólida existem sete placas principais e também há outras placas menores todas elas são chamadas de placas tectônicas Lembra do nosso exemplo de bom o preço do vídeo essas placas não são fixas elas se movimentam esse movimento pode ser de afastamento aproximação e as placas também podem deslizar uma em cima da outra mas por que que as placas se movimentam e o calor do núcleo da terra aquece o manto a parte que ficam mais aquecidas e outras Minas aquecidas por causa desta diferença as partes aquecidas sobem e as partes frias descem esse movimento de descida e subida movimento das placas tectônicas lembre-se as placas estão em movimento a continente se afastando e continente se aproximando claro que é questão de centímetros a cada ano esse movimento das placas pode causar terremotos tsunamis e vulcões a revisão aprendemos nesse vídeo que a Terra é como uma bola de futebol coberta por vários pedaços esses pedaços são chamados de placas tectônicas atualmente temos seis continentes África Ásia Antártida Oceania Europa e América esses continentes já foram Unidos e formavam um grande continente chamado pangeia um cientista alemão formulou a teoria da deriva continental que diz que esse grande continente se separam em vários pedaços esses pedaços se movimentaram até a formação dos continentes como é hoje aprendemos também que as placas tectônicas se movimentam esse movimento se dá por causa da movimentação do manto essa movimentação pode ir a terremotos tsunamis e vulcões E aí [Música] E aí
z2oF6Itzzyo,"Imagina tá de boa andando na floresta e dar de cara com uma libélula do tamanho de um urubu ou um escorpião marinho maior que um ser humano Parece até coisa de filme de terror, né Mas alguns anos atrás isso era real Há alguns anos atrás, há alguns bocado de ano Há 10000 anos atrás eu nasci há 10000 anos No passado, a Terra era dominada por criaturas colossais, como dinossauros, animais aquáticos e até mesmo insetos gigantes Mas por que esses insetos eram tão grandes E o que aconteceu para eles sumirem E será que esses insetos gigantes poderiam voltar a existir Hoje então vamos viajar no tempo e descobrir juntos os assustadores insetos gigantes do passado Então se ainda não é inscrito, se inscreva no canal e como de costume, deixa logo o seu joinha Yeah! Bora pro vídeo então Puxa a vinheta Se a gente entrasse numa máquina e voltasse no tempo para cerca de 300 milhões de anos, chegaríamos ao período carbonífero, uma era onde os insetos governavam o mundo Mas eles não eram como a gente conhece hoje, pequenininhos Eles eram verdadeiros monstros Então existiam libérulas gigantes com mais de 70 cm Nesse período, você também poderia encontrar facilmente um escorpião que poderia passar de 1 m de comprimento, tipo um tamanho de um cachorro, tá ligado E também sem topias que poderiam chegar a 2,5 m de comprimento Credo! Uh, só de pensar É uma cobra, meu Deus Mas a pergunta é: por que que naquela época esses bichos eram tão grandes O segredo para isso, galera, está no ar, literalmente Naquela época, a atmosfera do planeta era muito diferente e o nível de oxigênio era muito maior, chegando a 35% comparado aos 21% que temos hoje E isso fazia toda a diferença Não sei se vocês sabem, mas os insetos eles não respiram como nós Eles usam um sistema de tubos chamado traqueias que levam o oxigênio diretamente para os seus tecidos Quanto mais oxigênio no ar, maior eles podiam crescer Porque assim o corpo conseguia absorver oxigênio suficiente para alimentar um organismo gigante E por conta do seu tamanho do oxigênio com menos predadores, eles cresceram e se multiplicaram sem controle Mas segundo um estudo recente, alguns cientistas acreditam que esses insetos tinham que crescer tanto para que não fossem envenenados pelo oxigênio, como se fosse uma adaptação do corpo, né, uma forma de se manterem vivos Isso até os vertebrados começarem a dominar E como tudo na natureza, essa era chegou ao fim Bom, e agora então vamos conhecer alguns desses insetos que seriam resistentes à sua chinelada Considerado como o maior inseto que já existiu, um milípide chamado artropleura aterrorizava o período Segundo o fóssil de um elipíp gigante que foi encontrado em uma praia no norte da Inglaterra, essa criatura poderia ter 55 cm de largura e 2,63 m de comprimento, tipo do tamanho de um carro, podendo pesar até 50 kg E isso ou tornaria o maior invertebrado conhecido de todos os tempos Esse fóssil desse inseto gigante foi encontrado em 2018 e teria vivido há cerca de 326 milhões de anos atrás Isso daria mais ou menos 100 milhões de anos antes do surgimento dos dinossauros Outro gigantesco inseto que você não gostaria de dar de cara eram as libélulas gigantes, que ao invés de pousar no mato, ela poderia facilmente pousar na sua cabeça Elas podiam ter corpos de 40 cm de comprimento, com as envergaduras das asas chegando a 60 cm de comprimento Segundo alguns pesquisadores, essas libélulas gigantes poderiam se alimentar de pequenos animais, como por exemplo sapos, esquilos ou outros animais que existiam naquela época que tinham mais ou menos esse tamanho Agora, galera, se liga aí nesse fóssil que foi encontrado e comente aqui embaixo que inseto é esse Alguns vão sentir calavri só de ver, hein Já sabe qual é Pois é, isso daí era uma barata gigante Galera, esse fóssil foi encontrado na cidade de Mafra, em Santa Catarina, e tem aproximadamente 300 milhões de anos E nesse local não foi encontrado só um, mas vários fósseis de baratas gigantes Não dá para saber exatamente o tamanho, mas poderia passar facilmente aí de um palmo É, o seu chinelo não ia fazer efeito contra ela Era mais fácil ela pegar seu chinelo e te matar, mano Caraca! Ô louco, ô louco, bicho Ô louco De todos esses insetos, o que me deixou com mais medo é esse daqui que vamos mostrar agora O escorpião gigante marinho Esse carinha podia chegar a 2,5 m de comprimento com presas com mais de 40 cm Você tá doido Esse escorpião era praticamente então do tamanho de um jacaré Segundo os registros fósseis, esses escorpiões pertenciam aos maiores predadores marinhos daquela época Também pelo tamanho, né Naquela época alguns desses gigantes ocupavam o mesmo lugar na cadeia alimentar do que os tubarões brancos modernos Hoje em dia era meio do mesmo é p naquela época eles eram equivalentes aos tubarões Então se você tem medo de tubarão, você vai ter medo desse negócio aí eles poderiam usar seus gigantescos membros dianteiros para tecatar armando como garras para a garras as presas depois começar a destruir tudo e é agarrava e depois esmagavam em estruturas que se pareciam com dentes Parece um tubarão com sei lá, uma armadura, tá ligado Armadura Foram encontrados fósseis desses na Austrália e também na Europa E se a centopeia, né, sem pés hoje em dia já é grande, imaginaquela época Nem se chamava centopeia, se chamava milas Podendo chegar a 2,40 m de comprimento Se liga aí na comparação de um humano do lado desse inseto Meu, olha isso, velho Tá maluco Mas que que você faz para matar um negócio desse Virou amigo Tá com a bomba Eu viro amigo É, se ele não quiser virar amigo com você aí E apesar do seu tamanho, esse animal era muito importante para o ecossistema daquela época, pois seus hábitos alimentares ajudava o solo, pois com as suas interações com plantas e outras criaturas, contribuía para o antigo ecossistema Legal, hein Ó o tamanho, velho É, hoje em dia a centopeia tem 25 cm, tá ligado Aham Aí tem outras maiores com 90 cm Essa aqui tinha 2,5 m Mas esse bicho era do bem Apesar do seu tamanho, consumia apenas plantas assim reciclava o nutriente do solo, tá Mas o que aconteceu então com esses insetos Por que que eles não são tão grandes hoje em dia Primeiro ponto é a queda do oxigênio Com a evolução das plantas e mudanças climáticas, o nível do oxigênio caiu e os insetos gigantes não conseguiram mais sobreviver Coitadinhos Bem feito Outro ponto foi a ascensão dos vertebrados Répteis e anfíbios predadores surgiram e começaram a se alimentar desses insetos gigantes O terceiro fator foi a mudança no ecossistema, pois o mundo sempre está em transformação, favorecendo assim criaturas menores e mais ágeis A tendência é que com o tempo os gigantes vão sumindo, pois eles precisam de mais oxigênio, de mais alimento, de mais coisas para se manterem vivos Mas mesmo assim temos insetos gigantes, podemos dizer hoje em dia Como por exemplo o bicho pau, que pode chegar a 60 cm de comprimento, aquele do vida de inseto, sabe Tem também o besouro Titã da Amazônia que pode medir 16 cm Isso é muito grande para um inseto Imagina a força desse besouro E também, galera, existem várias centopeias gigantes, não daquele tamanho, né Mas que podem até caçar pequenos roedores atualmente Então, da próxima vez que você ver uma barata voadora, pega o seu chinelo, dá uma chinelada e agradeça Pois lembre-se, ela poderia ser muito maior Aí era com raquete de tênis É mesmo assim, ó Com a pá, sabe Com a arma, lança chamas E se você pudesse viajar no tempo, você teria coragem de viajar para essa época e conhecer esses insetos gigantes Ou você viajaria para uma outra época ver outras coisas Deixa aqui nos comentários onde você iria Se curtiu esse vídeo, já se inscreva no canal para não perder as próximas atualizações e também ative o sininho, beleza Porque assim quando sair vídeo novo, você vai receber a notificação Deixou seu like, então vamos ficando por aqui Obrigado pelo carinho, pelo vídeo Até o próximo vídeo, galera Isso tudo, pessoal Valeu, [Música] [Aplausos] [Música]"
