video_id,transcricao
Qs35xCxWwVI,"Olá pessoal hoje estamos prestes a mergulhar em um mundo repleto de curiosidades surpreendentes preparem-se para ficar fascinados com 25 fatos incríveis que você provavelmente não sabia em apenas com minutos se você gosta de aprender coisas novas e interessantes Este vídeo é para você então não se esqueça de deixar um like se inscrever no canal e ativar as notificações para não perder nenhum de nossos vídeos sem mais delongas vamos direto às curiosidades os Flamingos rosa não nascem com essa cor eles são cinzas quando jovens e adquirem a cor rosa devido a sua dieta rica em carotenoides a Muralha da China não é visível do espaço a olho nu apesar do mito popular é difícil de ser vista a partir da órbita da Terra o som não se propaga no espaço porque requer um veio para se deslocar como o ar no espaço não há ar para transmitir o som o récorde Mundial de tempo sem dormir é de 11 dias isso pode causar sérios danos à saúde o nome completo de Barbie a boneca é Barbara milicent Roberts as abelhas são capazes de reconhecer rostos humanos e lembrar quem as tratou bem ou mal a estimativa é que existam mais árvores na terra do que estrelas na Via Láctea o café é uma das bebidas mais negociadas e consumidas no mundo depois da água os golfinhos são conhecidos por dar nomes uns a s outros e responderem quando chamados por seus nomes o récorde Mundial de maior tempo sem piscar é 1:5 o Brasil é o maior produtor de café do mundo seguido pela Colômbia e pelo Vietnã a população mundial de Galinhas é maior do que a população de seres humanos os povos têm Três Corações sendo dois deles responsáveis pelo bombeamento de sangue para as branquias A Antártica é o lugar mais seco da Terra é um deserto que recebe muito pouca precipitação o Monte Everest não é a montanha mais alta do mundo se medido a partir do nível do mar mas é a mais alta acima do nível médio do mar o Alasca é o estado mais extenso do dos Estados Unidos mas também o menos populoso as bananas são geneticamente idênticas entre si devido à reprodução por meio de clones os gatos têm 32 músculos em cada orelha permitindo que girem suas orelhas em várias direções o maior órgão do corpo humano é a pele que pode pesar até 4,5 Kg o pulmão direito é maior que o esquerdo para dar espaço ao fígado o menor osso do corpo humano é o estribo localizado no ouvido médio uma gota de óleo de cobra tem a capacidade de matar até 100 pessoas o som do Trovão pode ser ouvido a até 25 km de distância de uma tempestade apenas uma em cada 2 bilhões de bolas de Neve contém uma partícula de poeira no centro que inicia sua formação a ONU possui seis línguas ofici árabe chinês espanhol francês inglês e Russo E aí pessoal o que vocês acharam dessas 25 curiosidades Espero que tenham se surpreendido tanto quanto eu se você gostou do vídeo Não esqueça de deixar o seu like compartilhar com seus amigos e se inscrever no canal para mais conteúdo interessante como este também adoraria ouvir suas sugestões para futuros vídeos nos comentários continuem explorando o mundo e descobrindo coisas novas até a próxima"
N7UYvWskkcc,"Você está prestes a ouvir 100 curiosidades em apenas 5 minutos Respire fundo, concentre-se e prepare-se para ter a mente explodida com fatos tão insanos que você vai querer ver de novo Sem enrolação, vamos direto ao primeiro: o mel nunca estraga — já encontraram potes com mais de 3000 anos em tumbas egípcias, ainda comestíveis! Polvos têm três corações e sangue azul O chocolate já foi usado como moeda pelos maias O coração de um camarão fica na cabeça Um raio pode ser cinco vezes mais quente que a superfície do Sol E o som mais alto da história foi a erupção do Krakatoa, ouvido a mais de 4800 km de distância! Existe um planeta feito de diamante chamado 55 Cancri e, e ele realmente existe A Lua se afasta da Terra 3,8 centímetros por ano A Torre Eiffel cresce 15 centímetros no verão por causa do calor Seu estômago se renova completamente a cada três dias As baratas podem viver por semanas sem cabeça — elas só morrem porque param de beber água Bactérias podem sobreviver por anos no espaço Os flamingos nascem cinza e só ficam rosa por causa da alimentação rica em betacaroteno Um polvo pode abrir um pote de conserva A cada dois minutos, tiramos mais fotos do que toda a humanidade tirou no século XIX inteiro A pele é o maior órgão do corpo humano Se esticássemos todos os vasos sanguíneos do nosso corpo, daria para dar duas voltas na Terra O Google processa mais de 8 bilhões de buscas por dia O cérebro humano gera energia suficiente para acender uma lâmpada de LED Toda vez que você lembra de algo, você reconstrói a memória do zero O olho de um avestruz é maior que o cérebro dele Os gatos não sentem gosto doce"
wW6OACofjRM,o mundo é um lugar muito estranho muitas vezes as coisas não acontecem de acordo com o planejado e Coincidências estranhas geralmente surpreendem com isso em mente não é incomum que haja fatos inesperados sobre tudo desde Geografia História ciência e tudo mais por isso as curiosidades interessantes a seguir foram escolhidas a dedo para você aprender e se divertir continue assistindo para descobrir mais sobre este mundo incrível e os seres que o habitam As Baratas existem há 120 milhões de anos antes mesmo dos Dinossauros vagarem pela Terra as abelhas podem picar outras abelhas Geralmente se se sentirem ameaçadas ou se estiverem protegendo seu território quando criança Adolf Hitler queria ser padre ele também sofria de ailurofobia que é o medo de gatos uma cervejaria no Canadá fabrica cerveja usando água de icebergs de 20 anos a qualquer momento há aproximadamente 2000 tempestades acontecendo na Terra como os humanos os coalas possuem impressões digitais individuais únicas em média uma pessoa anda o equivalente a três vezes ao redor do mundo na vida o núcleo da terra é tão quente quanto a superfície do Sol a Rota 66 é mais longa que a distância até o centro da terra a Islândia cresce 5 cm por ano por causa de suas placas tectônicas em movimento o deserto do Saara pode atingir até 136º 1 milhão de terras caberiam dentro do Sol os arrepios que você sente ao ouvir música são causados pelo fato de seu cérebro liberar dopamina a Austrália é mais larga que a lua o casamento do Príncipe Charles com a falecida princesa Diana atraiu quase 750 milhões de telespectadores em todo o mundo um terremoto de magnitude 12 dividiria a Terra ao meio a maior abóbora do mundo pesa mais do que um carro esportivo o coração de um camarão está localizado em sua cabeça a terra não é exatamente Redonda a rotação e a gravidade causaram um leve achatamento essa forma é chamada geoide cabo de guerra costumava ser um esporte olímpico a Finlândia é o país mais feliz do mundo de acordo com o relatório de felicidade mundial de 2019 os grãos de baunilha são produto da única orquídea frutífera do mundo a vanila planifolia mamutes lanosos ainda estavam vivos quando as pirâmides foram con antigamente as cenouras eram roxas e não laranjas A Ilha das Cobras ou Ilha da Queimada Grande fica em São Paulo no Brasil e tem 4000 cobras portanto é uma das ilhas mais mortíferas do mundo há um bilhão de micróbios em uma colher de chá de solo homens TM seis vezes mais probabilidade de serem atingidos por raios do que mulheres é fisicamente impossível para os porcos olharem para o céu você não pode roncar e sonhar ao mesmo tempo em média uma pessoa passa se meses de sua vida parada no semáforo esperando a luz vermelha ficar verde Picasso era um suspeito no roubo da monaliza em 1911 let lógica é o termo usado para quando você não consegue se lembrar de uma palavra um em cada cinco adultos acredita que alienígenas estão se escondendo em nosso planeta disfarçados de humanos todos os peixes palhaço nascem machos a Finlândia tem mais saunas do que carros o gator aid foi inventado na universidade da Flórida em homenagem ao mascote da escola os gators o voleibol e o basquete foram inventados em Massachusetts ao contrário do que você possa imaginar o Canadá come mais macarrão com queijo do que qualquer outro lugar existem mais de 70 variedades de cogumelos que Brilham no escuro os gatos exibem os mesmos principais estilos de apego que os bebês e cachorros segundo um estudo as pessoas desenvolvem primeiras impressões sobre você em um décimo de segundo a terra está repleta de vírus existem cerca de 10 nonilhões de vírus 10 elevado a 31 no planeta e isso é mais que as estrelas do universo pessoas que comem chocolate amargo TM menos probabilidade de ficar deprimidas Descobriu um grande estudo os mirtilos não amadurecem até serem colhidos o ketchup era usado como medicamento na década de 1930 o mel nunca estraga cada carro de polícia Holandês tem um ursinho de pelúcia os abacate são venenosos para os pássaros a goma de mascar queima cerca de 11 calorias por hora as bananas são curvas devido à forma como crescem em direção ao sol e essa foram as nossas 50 curiosidades aleatórias Não esqueça de deixar o like se inscrever no canal e se quiser uma parte dois comenta logo abaixo Obrigado por assistir e um forte abraço
qUWs5sZE4xc,o Iluminismo transformou a história e moldou o pensamento moderno mas o que fez esse movimento ser tão revolucionário descubra agora neste [Música] resumo se você quer entender melhor o iluminismo e de forma rápida está no lugar certo esse movimento ganhou força no século XVI na Europa Especialmente na França mas Primeiro vamos voltar no tempo e dar uma espiada em Como era a sociedade antes da chegada das ideias iluministas aquela sociedade vivia o chamado antigo regime onde a forma de governo vigente era o absolutismo política onde o soberano centralizava em si todos os poderes do Estado sem prestar contas à sociedade essa estrutura social e política garantia muitos privilégios à nobreza e ao Cler ou seja apenas uma parcela da sociedade aos demais faltavam direitos liberdade de expressão e sobrava trabalho e imposições havia também uma forte crença na religião e por isso o clero tinha poder e influência sobre tudo que acontecia Por isso os pensadores iluministas fomentaram ideias para mudar essa realidade eles defendiam o poder da Razão acima da fé e da religião visando pensar de forma crítica e racional tudo o que se relaciona ao ser humano e sociedade Por isso as ideias iluministas falavam da defesa da Liberdade individual para os cidadãos e também liberdade de expressão de crença e de associação do fim dos privilégios baseados no Nascimento garantindo que todos teriam os mesmos direitos e oportunidades desde o início da vida como também da Separação do estado e igreja e essas ideias causaram geral na economia os iluministas criticavam as ideias mercantilistas opondo-se aos monopólios e a forte intervenção do estado na economia na política queriam incluir a soberania do povo e a separação de poderes em executivo legislativo e judiciário e na religião que se misturava com o os pensadores defendiam o estado laico e queriam limitar os poderes e privilégios do clero e da igreja diante da Explosão de tantos questionamentos alguns monarcas adotaram ideias iluministas como o uso da razão no governo e a redução da influência da igreja no estado mas sem abrir mão do poder absoluto esses monarcas ficaram conhecidos como déspotas esclarecidos as ideias iluministas não se tornaram parte da realidade das pessoas da noite pro dia OK muitos movimentos e conflitos ocorreram ao longo do século e foram aos poucos transformando para sempre não apenas a estrutura social Francesa como de outros países europeus e do mundo até mesmo o Brasil publicações contrabandeadas e estudantes vindos da Europa espalharam as ideias iluministas aqui no Brasil levantando questionamentos em relação ao sistema colonial e sua exploração sem medida isso Acabou influenciando diretamente movimentos de resistência como Inconfidência Mineira conjuração baiana e a Revolução Pernambucana para saber mais sobre esses movimentos revolucionários é só clicar no link acima mas o Iluminismo não teria tanto Impacto Se não fossem as mentes iluminadas que espalharam seus ideais principalmente entre a burguesia que mesmo tendo poder econômico ficava à margem das decisões políticas entre os principais filósofos iluministas Podemos destacar montesquie conhecido pela sua teoria da Separação dos poderes estatais executivo legislativo e judiciário Volta Grande defensor das liberdades individuais e crítico da ferência da Igreja Católica na tomada de decisões dos Estados europeus dider conhecido pela criação da enciclopédia Rousseau que defendia a ideia de contrato social e autor da teoria sobre o bom selvagem John Lock filósofo inglês ligado ao liberalismo político e defensor da ideia de que o ser humano seria uma tábula rasa e Adam Smith filósofo fui economista escocês conhecido por suas teorias acerca da mão invisível do mercado as consequências do movimento das luzes foram capazes de mudar o curso da história Global Como por exemplo o questionamento ao colonialismo e também o declínio do absolutismo a política econômica também foi impactada através da implantação do liberalismo econômico onde o estado deixaria de intervir na economia deixando o mercado se regular livremente este movimento impulsionou também a revolução francesa que impactou o mundo inteiro ao destituir a monarquia e trazer os ideais iluministas para a realidade daquela sociedade gerando outras consequências presentes até os dias de hoje assim conseguimos perceber a importância de estudar este movimento e agora que tal praticar um pouco do que você aprendeu acesse a a página com vários exercícios aqui na descrição continue estudando história com a gente ficamos por aqui tchau
6QOkLu4kOOI,a Guerra Fria foi o conflito político-militar entre o socialismo e o capitalismo liderado pela União Soviética e Estados Unidos se você quer saber os detalhes mais importantes desse confronto e em pouco tempo está no lugar [Música] certo o fim da segunda guerra mundial trouxe a Vitória dos Aliados mas também colocou em evidência dois grandes protagonistas Estados Unidos e união Soviética no entanto em vez de paz o término da Guerra plantou as sementes de um novo confronto o início da Guerra Fria que recebeu este nome justamente porque nunca houve uma batalha direta entre as potências no entanto esse período foi tudo menos tranquilo em 1947 o Presidente Americano Harry Truman fez um discurso emblemático onde declarou Apoio às Nações que quisessem resistir à dominação estrangeira Mirando diretamente na expansão sovitica é esse foi o ponto de partida para um aumento das tensões globais entre as superpotências no mesmo ano o secretário de estado americano George Marshall lançou o plano Marshall oferecendo ajuda Econômica aos países da Europa Ocidental devastados pela guerra os Estados Unidos temiam o avanço de mais revoluções socialistas e consequentemente perder áreas de influência para a União Soviética que respondeu rapidamente para enfrentar a influência crescente dos Estados Unidos na Europa Oriental a União Soviética deu um passo estratégico criou o Comin form uma aliança que unia os principais partidos comunistas europeus Essa manobra resultou na formação de um poderoso bloco de nações conhecido como a Cortina de Ferro além disso a União Soviética lançou o comecon uma espécie de plano Marshall só que voltado para os países socialistas essas estratégias aumentaram ainda mais a rivalidade aprofundando a divisão entre leste e oeste europeu e consolidando o cenário de tensão que definiria a Guerra Fria no lado ocidental influenciado pelos Estados Unidos foram estabelecidos democracias liberais com exceção de Portugal e Espanha que viveram ditaduras e no lado oriental ocupado pelos países soviéticos foram estabelecidas as chamadas democracias populares em meio a esse hostil surgiram as primeiras alianças militares seria esse o prenúncio de um novo conflito em 1949 foi fundada a otan organização do trabalho do Atlântico Norte que uniu militarmente alguns países no objetivo de garantir a defesa contra a expansão Soviética Foi então que no ano seguinte uma invasão marcou o conflito bélico entre as duas potências só que bem longe dos seus territórios com a expulsão dos Japoneses da Coreia ao final da segunda guerra o território foi dividido com uma porção ao norte sob influência Soviética e outra ao sul sob a influência dos Estados Unidos e do ocidente no entanto a divisão não pacificou ação e ambos os lados se acusavam de violar a fronteira Até que em 1950 eclodiu o primeiro grande conflito Militar da Guerra Fria a guerra da Coreia para saber mais detalhes deste conflito escreva #guerra dakorea aqui nos comentários então a resposta ao anticomunismo veio logo em seguida a União Soviética criou em 1955 o Pacto de Varsóvia Uma Aliança Militar para impedir o avanço capitalista unindo alguns países para manter sua zona de influência e mais conflitos estouraram pelo mundo ligados à tensão entre a União Soviética e os Estados Unidos como a Guerra do Vietnã e a guerra do Afeganistão em meio a esse cenário de tensão a Alemanha foi dividida em dois países Alemanha oriental socialista e Alemanha ocidental capitalista por isso teve sua capital separada com a construção do muro de Berlim em 1961 essa barreira física visava impedir a saída de trabalhadores da Alemanha oriental em busca de melhores condições de trabalho os Estados Unidos também estenderam sua influência sobre os países da América do Sul na luta contra o comunismo houve interferência na política interna de vários países inclusive o Brasil mas em Cuba o socialismo imperou gerando uma crise quando em 1962 os soviéticos tentaram instalar uma base de mísseis por lá provocando uma reação imediata dos Americanos o impasse deixou o mundo à beira de uma terceira guer Guerra Mundial e nuclear mas o confronto Foi evitado por um fio e a disputa entre as duas potências foi para além do planeta Terra no final da década de 50 tanto Estados Unidos como União Soviética estiveram financeiramente na corrida espacial os soviéticos dispararam na frente com o lançamento dos satélites sputnick mas os americanos conseguiram a Façanha de pisar na Lua primeiro em 1969 essa disputa parecia não acabar até que o muro de Berlim veio ao chão muito mais do que a queda do muro esse evento simbolizou o enfraquecimento do regime socialista em 1991 com a desintegração da União Soviética a Guerra Fria chegou ao fim com isso o capitalismo se espalhou para todos os países do mundo e consolidou os Estados Unidos como potência mundial nas décadas seguintes Espero que você tenha curtido este super resumo sobre a Guerra Fria continue estudando história com a gente através desses vídeos até a próxima
nTmWFWWbzkQ,se você já deve ter ouvido falar sobre o efeito estufa e que ele está associado a desastres naturais e ao aquecimento global Mas e se eu te disser que se trata de um fenômeno natural e não um desastre espera então tá tudo certo o efeito estufa não é um vilão e porque estufa Neste vídeo você vai aprender o que é o efeito estufa suas causas e também suas consequências [Música] E aí [Música] é o efeito estufa é um fenômeno natural que ocorre através da concentração de gases na atmosfera do planeta Terra dos raios solares que atingem o planeta uma parte deles é refletida para o espaço e outra parte passa para a superfície terrestre a energia solar que atinge a superfície absorvida pela terra e pela água enquanto a outra parte é refletida de volta ao espaço então a energia que vem do Sol é convertida e a terra espalhe o calor para o espaço só que parte do calor espalhado é absorvido por uma camada de gases ficando na atmosfera e esses gases funcionam literalmente como uma estufa Sabe aqueles lugares criados para manter o calor em cultivos de flores ou plantas estes gases absorvem parte da energia irradiada pela terra aquecendo o planeta e ocasionando o efeito estufa este fenômeno é responsável por manter a temperatura do planeta que atualmente está em torno de quinze graus Celsius por isso o efeito estufa a sobrevivência de vida no planeta sem ele estima-se que a temperatura seria em torno de menos 18 graus Celsius ou seja 33 graus celsius a menos já pensou o planeta terra seria muito diferente e alguns seres vivos simplesmente não existiriam então se o efeito estufa é tão importante porque ele está associado ao aquecimento global como se fosse um grande vilão do nosso planeta isso acontece porque as ações humanas têm aumentado a quantidade de gases de efeito estufa na atmosfera com acúmulo de gases emitidos temos mais calor aprisionado na atmosfera o que pode ocasionar o aumento da temperatura média da terra resultando do aquecimento global e é como se fosse um carro que Está estacionado no lugar sem cobertura recebendo a luz do sol direta e com os vidros fechados lá dentro mesmo que o vidro permite a passagem da luz solar que impede a saída do calor aumentando a temperatura de dentro do carro se estiver frio o calor até vai bem mas se tiver muito calor a temperatura de dentro do carro será insuportável Aposto que você já deve ter entrado dentro de um carro nessas condições num dia de verão parece que estamos dentro de um forno não é mesmo agora que já entendemos como acontece o efeito estufa vamos conhecer os principais gases presentes Mary você é o 2 ou dióxido de carbono que é expelido pela queima de combustíveis fósseis utilizados em automóveis da queima de carvão mineral nas indústrias e da queima das florestas se você H4 metano que é um gás incolor inodoro e se inalado pode ser tóxico ele expedido pela digestão dos animais herbívoros mas também está presente na decomposição de lixo orgânico e extração de combustíveis É sim o n2 ó ó o óxido nitroso que um composto formado pela combinação de oxigênio com o nitrogênio gerado na decomposição de resíduos pelos microrganismos no solo e em atividades agrícolas principalmente pelo uso de fertilizantes [Música] o CFC ou clorofluorcarbonetos composto formado por carbono cloro e flúor é utilizado em aerossóis e em sistema de refrigeração e o vapor da água h2off que é nada mais do que partículas de água na forma de vapor encontradas em suspensão na atmosfera com o aumento da temperatura mais moléculas de água passam por evaporação e vão para atmosfera e como vimos o efeito estufa é um fenômeno natural e também necessário para o planeta mas se for intensificado com a emissão exagerada de gases pode ser perigoso aumentando a temperatura do planeta O dióxido de carbono é um dos gases mais emitidos nas atividades humanas ele está presente do desmatamento queimadas queima de combustíveis fósseis das indústrias e dos veículos causando efeitos desastrosos como o aquecimento global que põe em risco a vida no planeta por isso na tentativa de combater esses efeitos um novo acordo foi assinado em 2015 na conferência das Nações Unidas sobre as mudanças climáticas cop21 o acordo de Paris passou a ser o maior tratado internacional Acerca das mudanças climáticas um compromisso firmado com 195 países a fim de reduzir a emissão desses tipos de gases aceleradores efeito estufa e consequentemente Responsa o aquecimento global é Mas além de ações coletivas que nós podemos tornar mais conscientes algumas de nossas atividades pessoais cotidianas como por exemplo usar a bicicleta em pequenos trechos utilizar o transporte coletivo reciclar E também o uso de produtos reciclados e economizar energia elétrica em mesmo a redução do consumo de carne bovina e suína pode cooperar para a redução do aquecimento do planeta para conhecer mais desses efeitos causados pelo aquecimento global assistam nosso vídeo falando sobre esse assunto nesse vídeo aprendemos que o efeito estufa não é um vilão isso aí um fenômeno natural que Como o próprio nome diz funciona como uma estufa onde gases da atmosfera retém energia dos raios solares aquecendo a terra e garantindo o bom funcionamento da vida no planeta porém algumas ações humanas aumentam a emissão de gases que provocam o efeito estufa e Esse fenômeno pode esquentar demais o planeta e causar o aquecimento global o verdadeiro vilão nós vimos os principais gases de efeito estufa que são emitidos de diversas formas como na digestão de alguns herbívoros e também no desmatamento poluição queimadas e até os gases presentes em combustíveis os automóveis podem intensificar o efeito estufa causando um grande desequilíbrio por último Vimos que alguns países estão alguns anos tentando se unir em ações que reduzam a emissão desses gases mas é importante lembrar que além de ações coletivas podemos ser escolhas individuais que ajudam a resolver esse problema garantindo a vida no nosso planeta Eu espero que você tenha gostado desse vídeo e conta pra gente Qual atitude você tem tomado para contribuir para a redução do efeito estufa deixa aqui nos comentários não se esqueça de curtir esse vídeo compartilhar com seus amigos que se você quer aprender muito mais que só se inscrever no nosso canal e ter acesso a vídeos incríveis ficamos por aqui tchau tchau
