video_id,transcricao
arJVNwjhmRY,"qual é a verdadeira natureza do Universo para ter uma resposta os humanos criam histórias para descrever o mundo testamos essas histórias e aprendemos o que guardar e o que jogar fora mas quanto mais aprendemos mais complicadas e estranhas nossas histórias se tornam tanto que algumas dessas histórias são realmente difíceis de serem compreendidas é o caso da teoria das cordas uma história famosa controversa e muitas vezes compreendida sobre a natureza de tudo por que criamos essa teoria e será que ela está correta ou é só uma ideia que devemos [Música] abandonar para entender a natureza da realidade olhamos as coisas de perto e nos admiramos paisagens maravilhosas na poeira zoológicos de criaturas bizarras complexos robôs de proteína todos feitos de estruturas de moléculas com constituídas por incontáveis coisas ainda menores átomos nós pensávamos que eles eram a camada final da realidade mas ao colidir mos com muita força descobrimos coisas que já não podem ser divididas partículas elementares mas aí tivemos um problema Elas são tão pequenas que já não conseguimos mais vê-las Pense nisso o que é ver para ver algo precisamos de luz uma onda eletromagnética essa onda atinge a superfície da coisa e é refletida de lá para dentro do seu olho a onda carrega informações do objeto que seu cérebro usa para criar uma imagem então você não pode ver uma coisa sem interagir com ela ver é de certa forma tocar é um processo ativo não passivo isso normalmente não é um problema mas as partículas são muito muito muito pequenas tanto que as ondas eletromagnéticas que usamos para ver são grandes demais para tocá-las a luz visível apenas passa sobre elas é possível resolver isso criando ondas eletromagnéticas com comprimentos de onda cada vez menores mas mais comprimentos de onda é mais energia e se uma onda que tem muita energia toca uma partícula ela é alterada então ao ver uma partícula nós a modificamos assim não podemos medir partículas elementares com precisão este fato é tão importante que tem um nome o princípio da incerteza de Heisenberg a base de toda a física quântica então como é uma partícula Qual é a sua natureza não sabemos se olharmos atentamente podemos ver uma esfera de influência Bassa mas não as partículas em si só sabemos que elas existem mas se é assim como podemos fazer ciência com elas nós fizemos o que os humanos fazem e inventamos uma nova história uma ficção matemática a história da partícula pontual decidimos fingir que uma partícula é um ponto no espaço elétrons são um ponto com uma certa carga elétrica e uma certa massa todos indistinguíveis uns dos outros assim os físicos poderiam defini-los e calcular todas as suas interações é a chamada teoria quântica de Campos que resolveu muitos problemas o modelo padrão da física de partículas é baseado nela que prevê corretamente muitas coisas algumas propriedades quânticas do elétron por exemplo foram testadas e tem precisão de até 0,00 2% Então embora as partículas não sejam realmente pontos tratá-las como se fossem nos D um bom retrato do universo essa ideia não só fez a ciência avançar mas também nos levou a muitas das tecnologias que usamos hoje mas há um enorme problema a gravidade em mecânica quântica todas as forças físicas são transportadas por certas partículas segundo a relatividade geral de Einstein a gravidade não é uma força como as outras no universo se o universo é uma Peça as partículas são os atores mas a gravidade é o palco simplificando a gravidade é uma teoria da geometria a geometria do próprio espaço-tempo de distâncias que precisamos descrever com absoluta precisão se não há como medir com Rigor as coisas no mundo quântico a história da gravidade não funciona com a da física quântica quando os físicos t tentaram adicionar gravidade à história inventando uma nova partícula a matemática quebrou e este é um grande problema Se pudéssemos casar gravidade física quântica e modelo padrão teríamos a teoria de tudo então cientistas inventaram uma nova história Eles perguntaram o que é mais complexo do que um ponto uma linha ou uma corda assim nasceu a Teoria das Cordas o que faz essa teoria tão elegante é ela descrever partículas Element diferentes como os modos de uma corda vibrar uma corda de violino dá notas variadas ao vibrar Diferentemente e uma corda pode dar partículas diferentes e mais importante ainda ela inclui a gravidade a Teoria das Cordas unia todas as forças fundamentais do universo isso causou enorme entusiasmo e empolgação a Teoria das Cordas rapidamente virou uma possível teoria de tudo muito da matemática para uma teoria das cordas consistente não funciona em um universo com três dimensões espaciais e uma temporal a Teoria das Cordas requer 10 dimensões assim os teóricos fizeram seus cálculos em universos modelo e então tentaram retirar as seis dimensões adicionais e descrever o nosso universo Até agora ninguém conseguiu e nada previsto pela teoria das cordas foi comprovado em experimentos logo a Teoria das Cordas não revelou a natureza do universo pode-se argumentar que portanto a Teoria das Cordas não é útil a ciência é feita de experiências e previsões Se não conseguirmos fazer isso por que considerar cordas a questão é Como usamos a teoria a física é baseada na matemática 2 + 2 são 4 é a verdade Não importa sua opinião e a matemática funciona na teoria das cordas é por isso que a teoria das cordas ainda é útil Imagine que você quer construir um navio mas só tem o projeto para um pequeno barco aremo Há muitas diferenças o motor os materiais a escala mas ambos TM algo fundamental em comum são coisas que flutuam então estudar projetos de barcos a Remo pode trazer algo útil sobre como construir um navio com a Teoria das Cordas tentamos responder antigas questões sobre gravidade quântica tais como como os buracos negros funcionam ou o paradoxo da informação a Teoria das Cordas pode apontar a direção vista assim a Teoria das Cordas se torna uma ferramenta preciosa para os físicos teóricos ajudando-os a descobrir novos aspectos do mundo quântico e algumas matemáticas TZ a hisa da teoria das cordas não seja a teoria de tudo mas assim como a história da partícula pont também muito útil Ainda não sabemos Qual é a verdadeir natureza da realidade vamos continuar inventando histórias para tentar descobrir até que um dia quem sabe consigamos este vídeo foi patrocinado por você a produção de nossos vídeos leva muitas horas e se quiser nos apoiar para fazermos ainda mais pode contribuir pelo site patreon e ganhar seu próprio pássaro kutesa ou comprar algum item da nossa loja Nós criamos produtos de alta qualidade com temas científicos para despertar sua curiosidade pela ciência natureza e pela vida o mesmo esforço e amor que colocamos em nossos vídeos também colocamos na criação de nossos pôsteres cadernos roupas e acessórios e a cada compra você apoia diretamente o que fazemos neste canal mas por favor não se sinto obrigado a fazer isso assistir e compartilhar Nossos Vídeos Já Nos ajuda muito e somos gratos por você se importar com o que fazemos aqui Obrigada por [Música] assistir"
y-_Ly5Tqggc,"O que é Transtorno do Espectro Autista Você sabe o que é o TEA O TEA, Transtorno do Espectro Autista é o termo usado para diferentes transtornos do neurodesenvolvimento infantil, que tem como características marcantes as dificuldades na interação social, comunicação, comportamentos repetitivos, interesses restritos e alterações sensoriais Esse termo foi adotado para substituir todas as subdivisões que existiam para esses transtornos Desde então não existem mais Síndrome de Asperger, Transtorno Global ou Invasivo de Desenvolvimento Todos esses transtornos agora são conhecidos como TEA Segundo o Centro de Controle e Prevenção de Doenças dos Estados Unidos, uma a cada 68 crianças são diagnosticadas com o TEA Esse número significativo de diagnósticos fez com que a Organização das Nações Unidas classificasse o distúrbio como uma questão de saúde pública mundial No Brasil estima-se que tenhamos mais de 2 milhões de pessoas com algum grau de autismo Problemas de fala, sensibilidade a barulhos, falta de interação do olhar, irritabilidade com contato físico, agressividade, falta de resposta quando é chamada, interesse por parte de objetos, e repetição das mesmas palavras ou gestos podem ser alguns dos sintomas do autismo em crianças Apesar de as causas do TEA ainda não serem totalmente compreendidas, especialistas na área acreditam que a combinação de múltiplos fatores pode levar ao autismo Fatores como hereditariedade são responsáveis por cerca de 50% dos casos de autismo, sendo que a outra metade dos casos corresponder a fatores externos, como a poluição do ar, uso de pesticidas nos alimentos, complicações durante a gravidez e infecções causadas por vírus, entre outros É importante deixarmos claro que o TEA possui diferentes níveis de comprometimento da criança diagnosticada Por exemplo, crianças com nível leve de autismo podem apresentar dificuldades de interação social e comunicação verbal, enquanto outras podem desenvolver habilidades especiais, como QI elevado, facilidade para aprendizagem de línguas, memória impressionante, entre outras Crianças com nível moderado de autismo podem apresentar dificuldades de aprendizagem na escola, para compreender brincadeiras e se expressar verbalmente, enquanto outras podem frequentar a escola, serem funcionais e autônomas em algumas atividades Crianças com nível grave de autismo podem agredir a si mesmas e a outras pessoas de seu círculo de convivência Geralmente essas crianças dependem de outros membros da família para atividades cotidianas Hoje investimos na identificação precoce dos sinais de autismo, para orientação de pais e intervenção precoce A capacitação de pais e profissionais vem sendo fundamental para a identificação e direcionamento das intervenções O diagnóstico do autismo é clínico, feito através de observação direta do comportamento da criança e de uma entrevista com os pais ou responsáveis Novas tecnologias, como as que rastreiam o olhar das crianças enquanto elas assistem vídeos no computador, também contribuem para o diagnóstico correto, e a escolha da intervenção mais adequada para o tratamento do transtorno Quando o tratamento do autismo é feito precocemente, antes dos três anos de idade, a criança poderá desenvolver ou ampliar suas capacidades de compreensão, comunicação e interação social, pois este é o período no qual a criança entra no campo dos significados e interações com o outro Terapias comportamentais, de comunicação, terapias ocupacionais, fisioterapia e medicamentos são algumas das intervenções adotadas pelos médicos e familiares Mas é importante saber que cada criança exige um tipo de tratamento específico e individualizado Além disso, inúmeros cursos, livros, grupos de apoio e outros materiais informativos estão disponíveis, para que pais e profissionais da educação e da saúde possam aprender mais sobre o autismo e contribuírem com o tratamento das crianças Para melhorar a qualidade de vida das crianças com autismo e suas famílias, nós do INSTITUTO PENSI, reafirmamos nosso compromisso com o desenvolvimento de pesquisas a respeito do TEA, contínuo investimento em formação de profissionais, da área da saúde e educação, e conscientização de pais para a identificação e tratamento precoce do transtorno"
eSrObbUHbTQ,"dislexia ou dificuldade de leitura como diferenciar Pois é esse é um tema muito polêmico mas quando a gente coloca as evidências científicas fica muito mais fácil de fazer Bora mais para mais um vídeo aqui no nosso [Música] canal Olá aqui é Lu Britz E hoje nós vamos falar de um tema que principalmente depois da pandemia vem tirando o sono vem aí culpando muitos professores enfim né que é será que a dislexia aumentou depois da pandemia o que que aconteceu né o que que pode ter acontecido cada vez mais a gente tem visto essa questão da da dislexia e dos distúrbios específicos de leitura Então esse é um tema extremamente importante e polêmico mas a gente precisa estar entendendo como baseando em neurociências e Evidências científicas como é de praa aqui nos nossos conteúdos da neur sabrin então se você quer saber mais se inscreva aqui no nosso canal curta compartilhe Ligue as notificações Porque toda semana a gente tem um mega tema legal aqui trabalhando realmente para que a gente consiga entender essa questão das neurociências e mais do que isso fazer com que todas as crianças aprendam mas vamos lá vamos começar a falar sobre esse tema como que eu sei que é uma dislexia ou uma dificuldade de leitura bom quando a gente fala na dislexia nós estamos falando num distúrbio num transtorno específico de leitura tá E os transtornos específicos né de aprendizagens transtornos específico de leitura ele é um transtorno de origem neurobiológica né aproximadamente aí 5% da população tem dislexia e aí a minha pergunta quando a gente vê os nossos índices educacionais 50 60% das nossas crianças não t compreensão leitora será que tudo isso é dislexia Óbvio que não pra gente poder fazer a diferenciação do que é dislexia do que é dificuldade a gente tem que recorrer as evidências científicas e isso a gente vai estar falando aí do dsm5 isso mesmo que é o manual diagnóstico de transtornos mentais e lá ele mostra como que a gente deve fazer a diferenciação e o diagnóstico de uma criança com dislexia ou de aí simplesmente uma dificuldade de leitura então uma das coisas importantes a dislexia ela tem uma origem neurobiológica uma origem genética então familiares que já tenham tido dificuldades pra leitura pra escrita é um sinal importante uma outra coisa importante atrasos na linguagem né então crianças que atrasaram para falar ou que ainda depois dos cinco dos 6 anos ainda tem trocas na fala uma outra coisa também importantíssima todas essas dificuldades Elas têm que acontecer por mais de 6 meses e acontecer independentemente do professor do pai ou do cuidador que tá junto com essa criança e uma outra coisa importantíssima outro critério diagnóstico é esta criança ter passado por uma estimulação por um programa estruturado baseado em evidência científica por 6 meses se mesmo assim essa criança tiver passado por uma uma abordagem de alfabetização baseada em evidência e ela continuar apresentando déficits significativos na leitura somente aí a gente pode dar o diagnóstico de dislexia então vocês estão vendo que ele não é um diagnóstico simples ele é um diagnóstico de exclusão porque eu tenho que excluir problemas pedagógicos tem que excluir problemas emocionais tenho que excluir eh eh problemas familiares enfim questões em relação a programas educacionais Então eu tenho que excluir tudo dar uma instrução de qualidade baseada em evidência por se meses e se essas dificuldades por 6 meses continuarem acontecendo aí sim eu posso pensar em dislexia então eu não posso fazer o diagnóstico que deve ser o quê multidisciplinar sem antes promover ver com esta criança uma instrução explícita pautada em evidência científica trabalhando com cência fonológica conhecimento alfabético num programa de alfabetização com abordagem fônica se eu não trabalhei tudo isso eu não posso falar que essa criança é disléxica a probabilidade dela ter uma dificuldade de leitura é muito maior do que ela ter aí uma dislexia até olhando a proporção né gente 5% só das pessoas TM dislexia e se a gente olha a nossa realidade a maioria do que as nossas crianças T são dificuldades de leitura e daí gostou desse tema bacana né é muito importante a gente então tá trazendo as evidências científicas os programas baseados em evidência pra prática cotidiana do professor de sala de aula porque daí a gente consegue realmente separar o que é distúrbio transtorno de uma simples dificuldade espero que vocês tenham gostado dessa aula dessa Mega aula né 5 minutos a gente tenta dar uma aula mas são conhecimentos importantes Então comente aqui embaixo dê sugestões pra gente compartilhe este vídeo com quem precisa e até o próximo vídeo"
qVHPy7Np9rE,[Music] we decided to conduct an experiment and created two absolutely identical playrooms one was empty and there was a child in the other we invited children and gave them the opportunity to choose which room to play [Music] in the process of growing up children's opinions are influenced by society and their parents their perception of the world depends on adults [Music] as children get older it becomes more difficult for them not to notice that all people are different [Music] [Music] as for little kids they do not see the difference between children with special needs and those without [Music] [Applause] [Music] is [Music] this child made the decision to be part of an inclusive community but the world she ends up living in depends on you teach your children what they've taught [Music] you you
jizAto4-ofs,[Música] estamos no centro cultural da Eletronorte na Vila permanente onde é feita a recepção dos visitantes nesse local é distribuídos os equipamentos de segurança e é repassar as primeiras informações sobre os nossos processos de geração ano passado nós tivemos cerca de 4000 visitantes na usina nesse local também acontece alguns treinamentos profissionalizantes oferecido à comunidade da nossa cidade e da região Essa é a maquete do Centro Cultural onde é feita a as primeiras explicações para os visitantes sobre o nosso processo de geração nós temos nessa parte dessa maquete o que a gente chama de tomada da água é a parte onde é feita a captação da Água do lago que vai descer nesse tubo e vem até o fundo da casa de força essa água que vai descer aqui ela vai girar a turbina nesse momento nós vamos produzir energia mecânica que é o giro da turbina esse Giro da turbina é transferido para o giro do gerador para o giro do rotor no gerador e aqui nós transformamos a energia mecânica em energia elétrica essa energia elétrica ela é produzida em 13800 V que vai sair e passar no transformador na parte de fora aqui a energia é levada para 500000 v e segue nas linhas de transmissão para os consumidores essa água após girar a turbina ela vai cair nesse tubo e vai sair no fundo do rio na parte de baixo é e seguir o curso do Rio a água que já produziu a energia elétrica [Música] estamos no centro de Proteção Ambiental aqui é feito o gerenciamento dos programas ambientais e também é feita uma parada com os visitantes para conhecer o acervo ambiental da Região dos Lagos [Música] [Aplausos] [Música] na unidade de a e Conservação de plantas é feito o beneficiamento e armazenamento de sementes utilizados para a produção de mudas que serão distribuídas gratuitamente à comunidade para A Conservação da biodiversidade da região nesse local é feito a produção de aproximadamente 120000 mudas [Música] ano no Lago da usina hidrelétrica Tucuruí a Eletronorte possui áreas de preservação onde é feita a coleta de sementes essas sementes seguem para beneficiamento no laboratório de sementes na unidade de propagação e Conservação de plantas a usina hidroelétrica Tucuruí no Rio Tocantins é a segunda maior genuinamente brasileira a usina foi construída em duas etapas a primeira etapa teve início em 1974 e concluída em 1984 e a segunda etapa concluída em [Música] 2007 a usina possui 25 geradores tipo frances distribuído em duas casas de força que produzem 8535 MW de potência [Música] [Música] [Música] [Música] [Música] k [Música]
TUy6SC2MRig,máior nã esta foi a minha viagem pelo sistema solar foi incrível o lá até aqui eu preciso de você para uma nova aventura espero que você esteja preparada é uma missão muito importante um asteróide gigante está indo em direção ao seu planeta e temos que salvá lo vamos ter que estudar os movimentos de rotação e translação do planeta terra para comprovar se ele vai bater na terra ou não você me ajuda sim claro que sim a missão começa agora agora i há quanto tempo eu estava a pensar ou dady preciso que você me conte tudo o que você souber sobre o movimento de rotação e determinação do planeta terra hoje é o seu dia de sorte esta semana estudamos isso na escola e eu tirei um 10 [Música] o planeta terra assim como os outros planetas realiza dois movimentos de rotação e de translação você está bem desse movimento que a terra faz dirando em torno de si mesma se chama rotação da terra gira sobre um eixo imaginário que atravessa passando pelos pólos se você prestar atenção este chão um pouco inclinado quase 24 graus adora fim de quatro horas para dar a volta em torno de si mesmo que é o mesmo que um dia a rotação é a responsável pelo dia e pela noite na parte dominada é de dia e do lado oposto na parte escura é de noite entendeu sem o movimento da terra em torno de si mesma se chama rotação muito bem agora vou te explicar o movimento de translação movimento da terra ao redor do sol se chama transação a terra demora um ano para dar uma volta completa ao redor do sol antigamente pensava-se que a forma da órbita que a terra desenhava ao redor do sol era redonda mas não ela tem forma de elipse graças ao movimento de translação em inclinação do eixo de rotação da terra temos as estações do ano primavera verão outono inverno quanto mais inclinado estiveram a esfera em direção ao sol os raios solares chegam de forma mais direta até a superfície da terra faz mais calor e por isso é verão ao contrário outro hemisfério está menos inclinado recebe os raios de sol de maneira menos direta e inverno aqui podemos ver que não espera norte é verão no hemisfério sul o inverno nos seis meses acontecerá o contrário história do sul receberá os raios de sol de maneira mais direta e lá será verão no hemisfério norte será inverno como a translação da terra não é de 365 dias exatos mais de 365 dias que seis horas temos anos bissextos que tem um dia mais 366 dias por isso a cada quatro anos temos um dia a mais no mês de fevereiro o dia 29 [Música] uau impressionante então de acordo com estes cálculos o planeta terra está perdido o asteróide vai bater na terra em um minuto não mas você está considerando que estamos em um ano bissexto opa é verdade a terra se livrou do impacto do asteróide vai passar bem pertinho mas não vai tocá lá ebba e tudo graças ao ano bissexto [Música] se quiserem continuar aprendendo inscrevam-se no canal 2 maior nani clicando na foto e se quiserem ver mais vídeos clique em nesses quadradinhos [Música]
