video_id,transcricao
jz_As_nzSUA,sal moçada bem vindos aos cinco minutos sobre um assunto liberar aqui no canal livre e hoje vai falar sobre o romantismo chega aí moçada hoje a gente vai tratar de uma das mais importantes técnicas artísticas e literárias da história é o romantismo assunto que é presença garantida nas mais variadas provas de vestibulares e concursos e afins e tudo mais a o romantismo se desenvolve no século 19 tá certo é final do século 18 começo do século 19 aqui no brasil 1836 é o marco inicial na europa obviamente um pouquinho mais cedo então você pode colocar aí como contexto histórico do romantismo na europa o período pós revolução francesa se lembra do vídeo passado o arcadismo influenciado pelas idéias iluministas o iluminismo que influencia revoluções pelo mundo então pós revolução francesa nós temos uma burguesia que ascende ao poder e uma arte que vai é atender aos anseios aos interesses a ideologia burguesa e essa será a arte romântica então contexto do romantismo europa pós revolução revolução francesa no brasil aqui é chega no período da nossa independência pós independência em 1836 mas tá vamos falar sobre características dessa escola artística literária a primeira coisa que tem que saber é que o romantismo de certa forma se opõe ao arcadismo ao neo classicismo porquê porque é uma arte é produzida por e para uma nova classe social dominante acabei de dizer a burguesia ascende ao poder depois da revolução francesa e ela vai querer dominar o o duelo assim como pink e 10 querem dominar o mundo e dominar o mundo não só do ponto de vista é político não só do ponto de vista econômico mas também do ponto isto que brother filosófico idéias e ideológico e por conseguinte artístico então essa nova classe que ascendeu ao poder e que vai dominar o mundo nas mais diversas áreas da sociedade vai ter uma área que será a sua porta voz a arte da burguesia é o romantismo beleza e isso é importantíssimo para dar um start aqui nesse nosso vizinho o mesmo aqui da burguesia portanto o romantismo será um veículo de difusão das idéias da ideologia dos valores burgueses tá certo e quais são três valores burgueses que são três temas recorrentes no romantismo o casamento à religião e à nação ah eu gosto de marcar essas três palavras mas se você quiser substituir por lucy nomes já está valendo e vem de casamento há amor sentimento ao invés de religião deus espiritualidade ao invés de nação patriotismo a urbanismo mas essas três palavras aqui vai casamento religião e nação são centrais para a arte romântica outra coisa importante né tem a ver com o ideário burguês também a valorização do indivíduo e aqui você tem então a subjetividade brotando com uma grande característica artística não é o geral não é com lá os clássicos ou neoclássicos que queriam ter uma visão universal não é a visão individual é o meu então subjetividade que a subjetividade visão pessoal ea minha forma de ver o mundo é pelo crivo da razão ou da emoção razão era os neoclássicos o romântico ver as coisas pelo crivo da emoção portanto emotividade e quando você vê pela emoção o que acontece é velho geralmente distorce as parada lá ele não olha se você vê alguém que você ama você não vê a pessoa como ela é necessariamente mas você a vê como você sente que ela é então o romântico ele vai idealizar que a idealização e realização é o contrário de vou dizer se é o ideal com daniel a o ideal o prefeito é aquilo que eu vejo a moldado pelo meu sentimento então subjetividade sentimentalidade idealização também características importantíssimas do romantismo a outra coisa obviamente eu sou individual eu tenho uma obra que não pode se comparar com nenhuma outra lembra que os ipads do vídeo passado gostava de imitar milesi copiar os clássicos gregos romanos aqui não vai eu tenho que ser eu a a minha obra não pode ser parecida com nenhum thani se os romanos dane se os gregos eu sou original hoje a unidade também é uma característica importante romantismo e pra nós nos encaminhar no final do nosso vídeo o romântico é um cara que tá querendo fugir da realidade na alcântara jornada desligar do mundo vai escapando do mundo e escapismo o homem romântico que é fugir da realidade quatro são as rotas de fuga do romantismo à do homem romântico ele foge para o passado um passado mais distante idade média ou infância ele foge para o sonho para a fantasia a e ele foge também para uma natureza uma natureza idealizada e também a mais desesperada das rugas ele foge também pra morte tá certo e recitam é o romantismo e suas características gerais beleza moçada espero que tenham gostado do vídeo se você gostou curta e compartilha comenta se inscreve no canal e valeu aí pela atenção nós galera falou
U4VlAKE_fMg,salvo moçada bem vindos ao seguro sobre o assunto liberar e hoje vai falar sobre a poesia romântica no brasil chega aí avançada hoje a gente vai falar sobre a poesia romântica brasileira a gente viu no vídeo passado que o romantismo se é instaura na europa no final do século 18 começo do século 19 pós é revolução francesa vai trazer os ideais da burguesia na o casamento religião nação subjetividade emotividade idealização tudo isso que a gente viu no vídeo passado escapismo e busca da originalidade essa estética chega no brasil também no momento histórico muito importante é o ovo após a proclamação da independência na em 1822 surge o romantismo no brasil pouquinho pra frente em 1836 acerto a poesia romântica vai começar é embalada por esse clima de nacionalismo a poesia romântica vai ter três gerações no brasil na seqüência mais na cronologia casas ea primeira embarca nessa onda de nação recém-nascida então a primeira é a geração da poesia é nacionalista e essa nacionalidade esse nacionalismo esse 4 tista vai dar na busca do primeiro herói nacional que é o índio na europa e tinha como herói o cavaleiro medieval e aqui nós vamos responder a esse herói com um índio idealizado forte bravo corajoso muito inspirado nas idéias de russos or filósofo importante lá do iluminismo que falava que o homem nasce bom a a civilização corrompido o mito do bom selvagem influencia nossos primeiros poetas então quem são esses autores da pichação gonçalves de magalhães o primeiro autor a publicar uma obra romântica no brasil suspiros poéticos e saudades em 1836 surgimento do nosso romantismo mas o mais importante dessa geração é obviamente conçalves diz gonçalves dias é o cara velho ele é o fone cita patriotismo é patriotismo saudosismo acerto era patriota vai escrever um dos mais importantes poemas da nossa história que é a canção de cillio velho tá na hora no hino brasileiro cara o cara que fez o hino botou lá dois versos da canção do exílio para homenagear o cara nossos bosques têm mais vida à nossa vida em teu seio mais amores minha terra tem palmeiras onde canta o sabiá as aves que aqui gorjeiam não gorjeiam como lá no céu tem mais estrelas nossas vagas têm mais flores nossos bosques têm mais vida à nossa vida mais amores a lhe dão a ele também tem uma poesia indianista importante os timbiras um poema incompleto e em juca pirama velho um herói idealizado maravilhoso que ele chora diante da morte e suas é é ações bravas vão ser contadas geração após geração segunda fase do romantismo na poesia segunda geração mal do século ultra-romantismo barulhista levar o romantismo às últimas consequências igual é a última consequência do amor hum a morte a morbidez esses poetas são chamados de mal do século porque vão é é produzir uma poesia depressiva marcada pelo tédio pela vontade de morrer a presença da tuberculose que era a doença que assolava muitos desses jovens boêmios poetas que não alcançavam o amor na vida terrena a mulher sempre um anjo um sonho distante inalcançável inatingível navegável e na comida e ronan a e é como eu não posso tê la nessa vida eu quero passar para outra vida rapidamente a morbidez a morte o principal tema da segunda geração no brasil quem é o mais importante autor byron brasileiro alves de azevedo escreveu três obras fundamentais lhe dos 20 anos na poesia macário no teatro o cara que vende a alma para o diabo um diálogo com fausto lado guetti escritor alemão que inicia o romantismo na europa e também uma obra é de contos noite na taverna há ainda a sua ligação casimiro de abreu e podem infância e seu famoso poema meus oito anos e fagundes varela poeta de transição do poema marcante do calvário em homenagem ao filho morto emiliano pra fechar nosso vídeo terceira geração do romantismo e já são condoreira ou abolicionista é a geração que já vai sair do sentimento de sofrimento individual para o sofrimento do outro já é um passo em direção do realismo que veremos daqui dois vídeos a então lutar pelos cravos abolicionismo com do turismo com do símbolo da liberdade e também uma influência de victor hugo o poeta francês a polícia já são chamada de google ana que o mais importante autor josé desejar são castro alves o poeta dos escravos a o poeta de navio negreiro de vozes da áfrica só lembrar pra fechar nosso vídeo que castro alves tem uma poesia social famoses cima em defesa dos escravos retórica grandiosa grandiloqüente mas ele também tem uma poesia sensual e há uma diferença da visão da mulher em castro alves para os da segunda geração segurança à mulher cam genital em castro alves a mulher é vista de maneira mais sensual mais próxima a livros dele os escravos e espumas flutuantes esse é o romantismo da poesia do brasil espera que filmes do vídeo aí galera desculpa correria e quem gostou compartilha curta assim o nosso canal vamos aí falou
J7IysernjcQ,sal moçada cinco minutos sobre o assunto e trago hoje vai falar sobre o realismo chega aí moçada que acompanha o canal aqui do literal brasil primeira coisa é agradecer por um super abraço e nas pessoas que estão comentando dando lá e compartilham nossos vídeos se inscrevendo valeu a gente precisa dessa força a ideia é fazer vídeos curtos que revisem os conteúdos mais importantes da literatura brasileira e para vestibulares para concurso outra cultura geral mesmo ea gente tem é tido muito boa a resposta de vocês valeu mesmo sabe continua com a gente o assunto de hoje o realismo cada uma das mais importantes estéticas aqui no brasil tanto da literatura como nas artes em geral só que antes de falar do realismo eu preciso citar uma obra uma obra do romantismo no vídeo passado a gente falou sobre o romantismo na prosa falando sobre o romance do alencar do scudetto nero joaquim manuel de macedo e nesse período do romantismo que tem um romance que é diferente então velho a ele é publicada em 8 e 52 ou seja no auge do romantismo mas ele não orna como disparada a esses é que com o romantismo de modo geral esse romance é memórias de um sargento de milícias de manuel antônio de almeida por que esse romance é não um combina com o romantismo por vários motivos é primeiro que alguns dizem que ele é um pré realiza como anão cronológico porque ele é um dos 52 o realismo é lá em 81 30 anos depois mas pré realismo nas características alguns chamam de romance picaresco por causa da influência espanhola outros chamam de comédia de costumes enfim cara é um romance diferente é o romance apresenta a época de dom joão 6º o brasil janeiro em 1808 e é uma comédia bem humorada diferente dos romances trágicos sérios lado o romantismo a e vai apresentar segundo antônio cândido o primeiro malandro da literatura brasileira por isso não é um romance plenamente romântico não tem herói idealizado perfeito alto sarado cross fit está ligado não é um malandro vagabundo mentiroso é o filho de uma pisa dela e do beliscão que o leonard dinho que vai viver várias peripécias vai mentir ea enganar vai se mover com várias meninas e tal até que no final ele vai ser alçado à condição lado o sargento de milícias do título da série e vai se casar no final com um amor da sua adolescência que a vizinha por isso que esse romance ainda pode ser pode se dizer é certa forma dentro do romantismo mas é importante lembrar dele cara para as provas romance que destoa do romantismo mostras indenes sistema não é antônio de almeida leonard o primeiro malandro na literatura brasileira que depois vai dar se início à série de uma linhagem de malandros com macunaíma a o sombrio chicó enfim uma galera bom falado sobre isso vão agora o realismo ou irrealismo cá o realismo é uma estética de reação ao romantismo é a primeira coisa tem que saber o realismo brasil se desenvolve entre 1881 e 1893 mais ou menos um contexto portanto meados do século 19 na europa e aqui final do século 19 o início do realismo lá na europa se dá com uma obra famosa chamada madame bovary de gustave flaubert foi é processado o fogo é por causa dela foi proibida enfim a e aqui no brasil o realismo começa com memórias póstumas de brás cubas de machado s está características do realismo então você está num contexto em que o homem está se voltando para idéias mais materialistas mas cientificistas mais racionais é dessa época que surgem idéias como o evolucionismo de darwin tá certo o positivismo do augusto contra o determinismo tem o próprio socialismo do max todas as teorias e visões que apontam para um caminho é racional do mundo e portanto contrário à visão sentimental dos românticos dá certo então nesse clima vai surgir o realismo lá na europa e aqui no brasil no brasil o contexto obviamente outro é a transição do brasil império do brasil república o realismo chega aqui na década de 80 mas também é que temos o positivismo influenciam então a nossa própria república então esse contexto mundial também influencia a nossa realidade local quais são as características importantes do realismo à objetividade ou seja eu não posso é ser subjetivo ter uma visão pessoal das coisas eu tenho que ser o objetivo a o racionalismo uso da razão ao invés da emoção dos românticos e ao invés de casamento religião nação lembra os três temas lado o romantismo que eu citei no vídeo anterior aqui vai virar invés de casamento adultério maior festival de cordel stop tanto que o brasil não tem nenhuma obra que não tem um chapéu de topo ao invés de religião anticlerical contra o clero um padre de fora é de fácil os padres assina os padres que vôo de balão não é outra a e uma crítica social critica a hipocrisia da sociedade portuguesa a você tem é o tema da exploração do homem pelo homem há as mazelas sociais exploradas e uma arte que é uma embaixada de crítica e de tentativa de mudança social e principalmente para fechar ao invés de você ter uma arte é mais superficial você tem um ar que tenta sondar a psicologia à das personagens ao contrário dos nossos românticos na maioria das vezes esse é o realismo pessoal espero ter gostado da pele que compartilha comenta e chega e fica junto com a gente falou é o próximo
Xeugx_L24V0,fazendo a vocês meninas hoje fazer um xampu condicionador um condicionante o shampoo 2 em 1 o shampoo 2 em 1 e é um xampu específico para pessoas que têm casa tem cabelo supermercado cabelos quimicamente tratado um xampu que ele não somente lava mas ele também ajuda a restaurar a fibra do fio do cabelo então a gente vai precisar de um xampu com ph pode ser um xampu neutro e pode ser também pode comprar um xampu que seja também pode ser já ser um xampu que tenha um pouco de que seja um xampu hidratante porque ele vai ter um pouco um teor de hidratação vai ser um xampu pega o ph de são pedro de hidratante ele vai ser mais baixo então pode ser um xampu neutro ou pode ser também shampoo hidratante mas o objetivo aqui desse vídeo fazer um xampu hidratante potencializado um xampu com mais potência com mais hidratação então meus amigos a gente vai precisar de um showroom o shampoo pode ser de qualquer marca gente a gente vai usar um condicionador aqui eu vou usar um xampu à base de queratina tá que é aqueles cabelos que está fragilizado que precisa de mais de uma resistência no fio do cabelo mas que seja um xampu que também equilibre que não abra tanto a cutícula do fio do cabelo porque o que vai acontecer quando você for lavar o cabelo ele vai lavar e vai ajudar a reparar o dano causado pela poluição pelos efeitos mesmo é do sol e etecétera como também de química em minas mais detalhes eu vou deixar na fanpage vou deixar ninguém pra vocês quiserem sejam lá na página no facebook que eu vou de ser chamado explicando que o vídeo não durar tanto então vou explicar para vocês com mais detalhes então gente aqui ó o chanthu e valente vai usar o condicionador que no caso de queratina e depois eu vou lá e falar um pouco mais porque senão não dá nunca ficar muito grande então a gente vai usar aqui ó nesse pote aqui vai colocar mesma proporção de xampu e de um condicionador a tática mistura estão fazendo só um pouquinho pra vocês viram a quantidade que seja tem que misturar bem da gente [Música] e agora mas eu vou colocar a mesma quantidade de água agora a gente vai colocar vamos colocar agora aguardam misturando aos pouquinhos tá não fica muito honrado [Música] então meus amores são texto olha a quantidade exata são tehl medidas são as três medidas guasti água condicionador e do xampu vai misturar tudo bater bem batido preferência com esse negócio é quente bate ovo pra misturar bem concentrar bem e aí depois você vai colocar no seu patinho fazer o uso [Música] hei de amar [Música] essa consistência gente do xampu meninas aqui ó esse aqui é o shampoo pra vocês têm uma noção de como ele faz fuma bem limpa aquela massagem desperta no couro cabeludo pra motivar e aí você pode deixar ainda toda a sua família usar - qual o qual benefício pra vocês sabemos nós que cada momento que a gente tem o nosso cabelo está num momento diferente até pelo tratamento que a gente faz então o que você vai fazer a semana vai fazer o xampu um condicionador à base de queratina nesta semana vou ver o xampu a base de um outro não tinha outra diante uma outra coisa que o seu cabelo precisa no momento porque você tem que seguir o cronograma capilar porque ela é o cabelo de cada um tem um tipo de tratamento é um tipo de química cada um uma coisa diferente então por isso que existe um cronograma então esse daqui eu ter a china que foi tratado como eu disse no início do vídeo para que servia e aí vocês podem fazer seu próprio xampu vocês vão render um tratamento do cabelo vocês vão usar um xampu específico para o seu tipo de cabelo naquele momento eles vão apenas modificar o que o condicionador porque o xampu vocês podem comprar um campo grande e você vai só substituído por continuar danças como condicionador pequeno e vocês vão fazer lá no lucro vai ter uma rentabilidade muito grande e sem falar que juntar o cabelo então meus amores espero que vocês vão gostar dessa dica não esqueça se você gostou da dica leite compartilha diga aí escreve que no canal e não deixe de dar aquela curtida no vídeo gente mais detalhes eu estarei deixando lá na fanpage mais detalhado sobre nosso sozinho e o que ele faz um fio do cabelo o vídeo não ficar longo e vocês também aprender um pouco mais então meus amores deixa só ajuda os deixe suas dúvidas aqui que eu respondo também estava nos sabores e vou tentar responder através de vídeos um grande beijo com deus e até o próximo vídeo não querem ser negociais fui ideia já vende o veículo que bateu em mim o beijo [Música]
ZPmkNvM5yMQ,"[Música] Bora para uma make simples, simples, fácil E que toda mãe consegue fazer Primeiro vamos usar o corretivo Eu tô usando da Francine, só que o meu ele tá tão velho que até já sai Mas depois eu coloco o código da cor embaixo, tá Eu uso apenas nesses andares aqui na beira do olho, um ponto aqui do nariz e aqui em cima Aí conforme você for [Música] espalhando, ele pega o rosto inteiro e você não precisa pegar essa cor passar a base, é bem mais simples Lembrando que minhas pelees está hidratada, ela já está com hidratante Passo um restinho aqui em cima [Música] espalha bem aqui com o pincel fofinho assim, ó, mais parecido com esse Eu vou usar o pó compacto ultra fino da D Só da onde eu passei a maior parte do corretivo que é no olho aqui, né Só pode apertar aqui assim também, ó No meu caso, eu passo aqui na zona T porque minha pele é muito oleosa nessa parte, [Música] tá Aqui assim, ó E agora que eu percebi que eu estou sem microfone para mim de novo Eu só tô tão acostumada a fazer isso que ela não sabe nem prender o microfone Beleza, voltando aí eu tenho essa paletinha Essa paletinha da Bom que ela tem blush blush, controle e iluminador Eu gosto de misturar os dois blush e passo aqui assim, só para dar uma cor para não criar essa cara, uma corzinha pelo menos Aí eu pego o contorno, dobro e passo um pouquinho aqui Mesma coisa do outro lado Aí aqui no nariz eu faço bem pouquinho, como se eu tivesse afinando meu nariz Eu acho que é espina, então eu não faço muito isso aqui Mas preciso ficar com cara de pálida, parecendo que você, sei lá, como aquela cara pálida parecendo que você vê a sombração da casa Passa tudo Passa um pouco aqui no nariz também Beleza Pare dar uma olhada É, vamos parar mesmo Aí para dar uma corzinha no olho, eu pego o iluminador com dedo e passo assim, ó Uma corzinha Certo Agora eu vou pegar máscara de cílios da Nina Sprers, que também está velha, precisa ser trocada Se for parar para ver todas as minha tão velho Preciso trocar todas Eu nem lembro a última vez que eu comprei Essa parte a gente ignora e continua usando até a hora que dá uma alergia Quando d uma alergia a gente para Não faça isso Eu só faço porque sei lá, eu comprei de [Música] comprar Faço assim, ó para dar uma p meu olho E agora a gente pega o um blush, esse multifuncional da Nina C Ele é blush, sombra e também pode passar na boca Eu gosto de pegar ele com o dedo assim e dar atidinhas assim na rca, ó, que daí dá uma corzinha e não fica tão forte E aí, gostaram dessa make Simples Temos três itens E assim para ficar em casa tá de boa, ó Sei lá, vou tô só querendo esconder as olheiras Pronto Simples e fácil Agora, se vocês quiserem mais dicas de tudo um pouco maternidade, beleza, qualquer coisa, me segue aí e comenta se gostou Sero"
