video_id,transcricao
Y_befLlahys,"[Aplausos] [Música] Abemos papa Tá todo mundo aí falando do novo papa e a gente aqui ficou muito curioso para saber como é que eles fazem aquela fumaça que uma hora sai preta e a outra hora sai branca Alguns jornais até chegaram a divulgar como é que é feito, qual é que é a fórmula, mas eu não vi ninguém reproduzindo essas duas fumaças direito, não Então hoje a gente vai reproduzir as fumaças do Vaticano aqui na nossa capela cistina [Música] Acabou de ser eleito o novo papa para quem tava viajando na lua em Marte, sei lá Ele é o cardeal Robert Francis Prevost, tem 69 anos Ele é o primeiro papa que veio dos Estados Unidos, mas atuou no Peru Não vou ficar dando detalhes de como é feita essa eleição, mas ela acontece dentro da Capela Cistina que fica ali no Vaticano Ela é aquela igreja que o Michelângelo pintou todo o teto Como não tem ninguém filmando, fazendo live lá de dentro, para anunciar o resultado, eles queimam as cédulas e sai uma fumacinha por uma chaminé que fica ali em cima da capela Se ela for preta, é porque eles ainda não conseguiram chegar num resultado Se ela sair branca, é porque foi eleito o novo papo Será que foi daí que tiraram a ideia de chá revelação Mas o mais importante, o que decide a cor da fumaça é pura química O próprio Vaticano divulgou a fórmula da fumaça Olha lá A preta é perclorato de potássio, antraceno e enxofre E a branca é clorato de potássio, lactose e resina Assim que eu li o nome desses ingredientes, eu corri lá para um quartinho, fi, aqui no fundo do Manual do Mundo, onde a gente guarda os ingredientes de química Aí eu comecei a achar coisa que tava lá fazia uns 12 anos mais ou menos E achei quase tudo para formar essas fumaças O perclorato e o clorato de potássio servem para fornecer oxigênio pra queima A gente não tinha, mas vamos usar nitrato de potássio, que também serve e é mais fácil de encontrar Ele é bastante usado em fertilizantes O antraceno é bem parecido com o naftaleno, que nada mais é do que naftalina Por causa do formato da molécula, a gente diz que eles tm anéis aromáticos A naftalina é meio tóxica, então a gente vai ter que usar máscara Resina é a mesma coisa que breu E isso a gente tinha bastante porque uma vez a gente tentou fazer uma bola perfeita que não deu certo É a seiva da árvore Isso aqui é um breu de pinos, tem um cheiro bem gostoso Enxofre a gente também tinha Eu acho que eu nunca usei para nada Tá na classe daquelas coisas que a gente compra aqui no Manual do Mundo para um dia usar e chega uma hora que a gente usa mesmo E a lactose pura a gente não tinha, mas é uma das coisas que tá no leite em pó, então ele vai substituir com louvor a lactose nessa fórmula Quem nunca mudou uns ingredientes na receita que atilha a primeira pedra Antes de separar os ingredientes, eu vou montar o nosso forninho Isso aqui é uma chaminé de churrasqueira que opa, vou cair da escada, que ultimamente a gente estava usando pra ser a saída do corte a laser Então, a gente desconectou e embaixo eu vou colocar esse forninho que nada mais é do que um bujãozinho de gás que o Gu Toledo deixou aqui da última vez que ele veio me ensinar a cortar coisas com plasma Então vamos montar esse forno de alta tecnologia aqui Não é por nada não, mas a nossa chaminezinha tá bem parecida com a do Vaticano, hein Queimar voto e sair fumaça é uma tradição bem antiga, mas essa coisa da fumaça sair preta ou branca é relativamente recente A primeira vez foi em 1914 Naquela época a coisa ainda não era exatamente uma fórmula química Eles queimavam palha mesmo E eu acho que a gente podia fazer um teste com palha para ver se dá certo, né Faz de conta que eu tive essa ideia agora e ninguém pensou nisso antes, né A ideia primeiro então é fazer a fumaça preta Eu vou colocar um pouco de palha E aqui vão os votos por cima [Música] Nossa, isso pega fogo muito rápido Caramba, durou 10 segundos, não deu nem tempo da gente sair correndo lá fora para ver que cor que era Agora é valendo Eu vou tentar tampar um pouco a boca do forno aqui pra queima acontecer mais devagar e formar mais fumaça preta Pode, pode mostrar a chaminineia da capela assistindá Espero que a fumaça esteja preta [Música] Eu tô aqui dentro, eu não vi nada de fumaça, mas se acha que saiu uma fumaça preta, valia aquele joinha, não valia não A fumaça branca é praticamente a mesma coisa, só que tem uma mudança aqui embaixo que é bem simples, que é botar um pouco de palha molhada Como você viu que o fogo é bem forte, eu posso molhar para valer mesmo Vamos lá Dessa vez eu também quero ver a fumaça saindo lá fora Será que sai [Música] branca E pensar que essa é só a primeira parte, hein Pelo menos aqui no nosso teste, a diferença entre a fumaça branca e a preta é muito evidente Mas não foi o que aconteceu em 1958, na eleição do Papa João 23 Saiu uma fumaça meio acinzentada e as pessoas ficaram meio perdidas ali Ninguém sabia se tinha sido escolhido o papa ou não E aí eles resolveram trocar o jeito de fazer fumaça Não existia manual do mundo na época, né Senão a gente teria feito essa fumaça aí a cor certa Mas enfim, por que que uma hora a fumaça sai preta, outra hora a fumaça sai branca O preto é carbono, é combustível que não queimou Aconteceu uma queima incompleta ali, acabou sobrando um pouco de fuligem Essa fuligem sai junto com a fumaça, não deixa a luz passar e a gente vê uma fumaça preta A fumaça branca é água mesmo, é o vapor de água que sai ali na forma gasosa Quando encontra com ar mais frio lá em cima na chaminé, ele começa a condensar e forma microgotículas de água líquida, assim como a gente tem nas nuvens Mas vamos pra fórmula moderna agora Quem faz a fumaça preta é o naftaleno, que não queima direito e acaba soltando bastante carbono A função do enxofre é ajudar a queima do antraceno, que no nosso caso é o naftaleno, que demora um pouco para queimar E o nitrato de potássio, como eu tinha explicado para vocês, ele fornece oxigênio pra [Música] queima Vamos primeiro fazer um teste pequenininho E aí, será que a gente acertou na fórmula [Música] Já acertamos três vezes, hein Vamos tentar a branca com a fórmula química Agora, a função do leite em pó e do breu também é soltar um pouco de carbono, mas não vai ser um carbono puro São algumas moléculas mais complexas com carbono e outros elementos químicos que evaporam e depois condensam, assim como acontece com a água E mais uma vez um pouquinho de nitrato de [Música] potássio Ah, branquinha, branquinha Muito legal Mas eu prometi no começo do vídeo uma fumaça lá na nossa capela Cistina Vamos aumentar um pouquinho essa [Música] receita Vamos primeiro com a fumaça preta, porque no Conclave ela sempre vem antes da branca Parou, parou, parou Só para lembrar que no próximo final de semana vai ter lançamento do grande livro de biologia e do nosso livro Mistérios do Universo em Belém e em Macapá São os últimos dois lançamentos desse primeiro semestre Tô deixando as datas aqui do lado Quem quiser saber mais sobre esses livros que estão muito legais, eu tô deixando o link aqui na descrição Fechou Eu acho que a gente trocou de pote e não funcionou, não pegou [Música] fogo Ah, rapaz, não temos papo ainda, mas a fumaça preta funcionou [Música] Agora sim, tá na hora de eleger o novo papa E se você não deu joinha, esse é o [Música] momento Agora sim [Música] Se isso aqui não vale o joinha, eu não sei o que [Aplausos] vale Me dá uma marreta, por favor, Lucas [Música] Acho que a gente exagerou um pouco no fogo Fazia bastante tempo que a gente não tinha experiência de química aqui no Manual do Mundo Então vou deixar uma playlist aqui da nossa série especial super química, que é uma experiência hardcore atrás da outra Ah"
5Br-Z4Y3b-U,"Se você começa um projeto novo toda vez que vai editar um vídeo, isso tá te atrasando e eu vou te mostrar agora no vídeo de hoje Primeira técnica, template modular de roteiro Primeiro você vai começar obviamente com abertura Depois a gente vai pra história, problema, solução e CTA Abertura O que que a gente precisa nada mais nada menos do que o nosso gancho Chame a atenção do público logo nos primeiros segundos com algo provocativo História Não necessariamente você tem que ficar contando uma história, mas óbvio, você tem que se conectar com o seu público Problema, a gente vai aqui, ó, mostrar o que eles estão fazendo de errado Solução A gente vai mostrar um método ou algo que resolva esse problema citado E o CTA, a gente vai convidar o público para o próximo passo, seja ele qual for Isso aqui é um padrão que eu utilizo na maioria dos roteiros e sempre seguindo esse estilo, você não vai mais perder tempo pensando em um roteiro que na maioria das vezes tem o risco de ficar muito chato Próxima técnica, espelhamento de câmera com aplicativo Eu imagino que você saiba que a câmera traseira do seu celular, ela é muito melhor do que a frontal E mesmo você que tem uma câmera sabe que na maioria das vezes é muito confuso e complexo você ficar se vendo ali tentando se enxergar Então na hora de gravar eu uso um aplicativo que ele vai espelhar a minha câmera ou o meu celular no computador Eu consigo ver foco, enquadramento, a luz, né Se ela tiver meio ruim, se ela sair do lugar, começa a fazer isso que você vai ver o quão ágil vai ser a sua gravação no dia a dia Técnica de número três, presets Aqui dentro do Filmora você consegue agilizar alguns processos também com os presets, que são as coisas que você mais usa, deixando ali na mão, sem você precisar procurar ou refazer Você pode favoritar efeitos, transições, efeitos sonoros, os luts e os filtros também, né Tudo isso vai facilitar muito a sua vida Quando você for editar, é só você ir ali, ó, nos favoritos de cada um deles e arrastar para o seu projeto Tem várias outras ferramentas que estão economizando um baita tempo na minha edição, como é o caso da detecção de silêncio, que simplesmente com clique você já vai cortar os respiros e os momentos que você não falou nada durante o seu vídeo E além disso, um hackzinho aqui que eu costumo usar bastante com a ferramenta edição com várias câmeras Basicamente ele serve quando eu tenho muitos vídeos Ao invés de eu colocar um por um ali na timeline, eu simplesmente junto tudo, mando para essa ferramenta como se fosse um ângulo diferente e vou cortando simplesmente clicando em cada um deles E pra nossa última técnica, eu sei que você ainda deve estar querendo saber o motivo de eu nunca começar um projeto novo Assim como eu falei dos presets, uma das coisas que ajudam muito é montar um projeto com tudo que você sempre usa nas suas edições, com vinhetas, músicas, transições, até pode nomear algumas passas e tracks da forma que você quiser E aí, claro, você vai deixar esse projeto com o nome de projeto padrão Toda vez que você for editar, é só duplicar, mudar o nome e começar a trabalhar nele Porque, ó, quem domina o tempo vai dominar a criação e, claro, ganhar muito mais E além disso, eu vou te indicar esse vídeo aqui também, que tem tudo a ver com o tema que a gente falou agora É isso e eu te encontro muito, muito em breve Oh"
9aI5v1cexWc,está vendo essas Torres que carregam os cabos de transmissão são eles que levam energia elétrica para as casas do Sul Sudeste e centro-oeste do país desde a usina de Taipu no Paraná mas tem um processo enorme para que isso aconteça e por aqui tudo é grande mesmo esses dutos de metal por exemplo são 20 deles ao longo de quase 8000 de concreto acima que formam a barragem pelos dutos cai a água represada que movimenta as turbinas e gera energia o Bruno Engenheiro aqui da Itaipu ele vai acabar sendo também o nosso guia para mostrar todos os detalhes e o funcionamento mas aqui do lado de fora ele já estava me contando uma curiosidade sobre essa estrutura de metal aqui ele falou assim você tem a curiosidade de encostar a mão eu falei o que que vai acontecer e é isso dá para ouvir o barulho e aqui tá uma vibração bem que dá para perceber fácil fácil que aquilo a água que tá caindo lá tá indo lá para baixo e por aqui ó tá vibrando [Música] [Aplausos] bonito nosso passeio pela hidra elétrica de Taipu Agora é para baixo até 90 M abaixo de onde estávamos no começo da reportagem aqui funcionários paraguaios e brasileiros são encarregados do funcionamento da segunda maior usina hidroelétrica do mundo a Mega obra levou mais de 10 anos para ser concluída começou em 1971 e uniu dois países que compartilhavam as margens do rio Paraná na época a cidade de Foz Iguaçu tinha 20000 habitantes e o canteiro de obras o dobro disso 40000 trabalhadores era o maior projeto do mundo na época e também o mais inovador gerar energia elétrica renovável com a água represada sendo reutilizada até hoje Taipu é modelo para outras usinas e toda a estrutura física de hoje é a mesma de 50 anos atrás esta sala mantém um pouco dessa história lá nas paredes estão painéis de controle e alarmes de funcionamento Eles foram substituídos por equipamentos mais modernos controlados por computadores hoje manuseados por cinco funcionários apenas mas os antigões não perderam serventia não funcionam como uma barreira de segurança um backup caso algum computador apresente falha numa outra sala também temos uma visão de parte desse trabalho e para qualquer um que não trabalha aqui esses sinais luminosos e inscrições são incompreensíveis tudo por aqui é grande demais espaçoso demais barulhento demais Chegamos no local onde a gente consegue melhor visualizar o efeito da força da água quando ela cai aproximadamente 100 m e aqui gira a turbina que com a capacidade elétrica acaba gerando também energia esse ponto aqui ele é diferenciado também nesse ambiente estou gritando por causa do barulho que o equipamento faz e a temperatura aqui é diferente tudo isso aqui tá funcionando e aqui faz mais calor do que lá fora é bem diferente isso aqui os funcionários que nos acompanham explicam que tudo aqui foi construído para um funcionamento perfeito e mesmo quando existe a necessidade de reparos isso também foi planejado para ser feito de forma perfeita são as tampas das unidades geradoras onde nós temos equipamentos Associados geração de energia é pro pessoal ter acesso quando realiza a manutenção então aqui a gente consegue desmontar e o pessoal acessa aqui as o gerador o rotor para fazer inspeções e as Man questões periódicas Subimos de volta ao nosso lugar de entrada o ônibus que vem do Paraguai está transportando funcionários para o lado brasileiro são todos funcionários da empresa binacional agora vamos subir para o topo da usina reparem que o elevador não marca andares mas sim a altura que estamos de acordo com o nível do mar agora que nós mostramos para vocês como é que é o funcionamento dessas turbinas nós vamos mostrar também uma parte fundamental de toda essa operação de energia elétrica essa aqui é a principal barragem de Taipu tá vendo quanto que a gente tem que caminhar por aqui e pra geração de energia nesse nível Você também precisa ter uma quantidade enorme de água e é isso que nós vamos mostrar para vocês essa quantidade de água represada Dá uma olhada Essa é a represa de Taipu por tudo quanto é lugar que você olhe vai ter água a água represada ocupa um espaço de terra de 1320 km qu está a 220 m de altura para a água cair com muita força e mover as turbinas lá no subsolo Praticamente tudo que mostramos nessa reportagem faz parte do roteiro turístico dentro de Taipu a parada final é num Mirante estrategicamente construído para ter uma ampla visão dessa monumental obra de engenharia aí tem concreto suficiente para erguer 200 estádios do Maracanã ferro e aço para erguer 400 Torres eem féu terra Rocha escavados com volume nove vezes maior do que o eurotúnel e pensar que o resultado final sai assim sem ninguém ver o ouvir por esses cabos no Alto das torres de [Música] transmissão
z2oF6Itzzyo,"Imagina tá de boa andando na floresta e dar de cara com uma libélula do tamanho de um urubu ou um escorpião marinho maior que um ser humano Parece até coisa de filme de terror, né Mas alguns anos atrás isso era real Há alguns anos atrás, há alguns bocado de ano Há 10000 anos atrás eu nasci há 10000 anos No passado, a Terra era dominada por criaturas colossais, como dinossauros, animais aquáticos e até mesmo insetos gigantes Mas por que esses insetos eram tão grandes E o que aconteceu para eles sumirem E será que esses insetos gigantes poderiam voltar a existir Hoje então vamos viajar no tempo e descobrir juntos os assustadores insetos gigantes do passado Então se ainda não é inscrito, se inscreva no canal e como de costume, deixa logo o seu joinha Yeah! Bora pro vídeo então Puxa a vinheta Se a gente entrasse numa máquina e voltasse no tempo para cerca de 300 milhões de anos, chegaríamos ao período carbonífero, uma era onde os insetos governavam o mundo Mas eles não eram como a gente conhece hoje, pequenininhos Eles eram verdadeiros monstros Então existiam libérulas gigantes com mais de 70 cm Nesse período, você também poderia encontrar facilmente um escorpião que poderia passar de 1 m de comprimento, tipo um tamanho de um cachorro, tá ligado E também sem topias que poderiam chegar a 2,5 m de comprimento Credo! Uh, só de pensar É uma cobra, meu Deus Mas a pergunta é: por que que naquela época esses bichos eram tão grandes O segredo para isso, galera, está no ar, literalmente Naquela época, a atmosfera do planeta era muito diferente e o nível de oxigênio era muito maior, chegando a 35% comparado aos 21% que temos hoje E isso fazia toda a diferença Não sei se vocês sabem, mas os insetos eles não respiram como nós Eles usam um sistema de tubos chamado traqueias que levam o oxigênio diretamente para os seus tecidos Quanto mais oxigênio no ar, maior eles podiam crescer Porque assim o corpo conseguia absorver oxigênio suficiente para alimentar um organismo gigante E por conta do seu tamanho do oxigênio com menos predadores, eles cresceram e se multiplicaram sem controle Mas segundo um estudo recente, alguns cientistas acreditam que esses insetos tinham que crescer tanto para que não fossem envenenados pelo oxigênio, como se fosse uma adaptação do corpo, né, uma forma de se manterem vivos Isso até os vertebrados começarem a dominar E como tudo na natureza, essa era chegou ao fim Bom, e agora então vamos conhecer alguns desses insetos que seriam resistentes à sua chinelada Considerado como o maior inseto que já existiu, um milípide chamado artropleura aterrorizava o período Segundo o fóssil de um elipíp gigante que foi encontrado em uma praia no norte da Inglaterra, essa criatura poderia ter 55 cm de largura e 2,63 m de comprimento, tipo do tamanho de um carro, podendo pesar até 50 kg E isso ou tornaria o maior invertebrado conhecido de todos os tempos Esse fóssil desse inseto gigante foi encontrado em 2018 e teria vivido há cerca de 326 milhões de anos atrás Isso daria mais ou menos 100 milhões de anos antes do surgimento dos dinossauros Outro gigantesco inseto que você não gostaria de dar de cara eram as libélulas gigantes, que ao invés de pousar no mato, ela poderia facilmente pousar na sua cabeça Elas podiam ter corpos de 40 cm de comprimento, com as envergaduras das asas chegando a 60 cm de comprimento Segundo alguns pesquisadores, essas libélulas gigantes poderiam se alimentar de pequenos animais, como por exemplo sapos, esquilos ou outros animais que existiam naquela época que tinham mais ou menos esse tamanho Agora, galera, se liga aí nesse fóssil que foi encontrado e comente aqui embaixo que inseto é esse Alguns vão sentir calavri só de ver, hein Já sabe qual é Pois é, isso daí era uma barata gigante Galera, esse fóssil foi encontrado na cidade de Mafra, em Santa Catarina, e tem aproximadamente 300 milhões de anos E nesse local não foi encontrado só um, mas vários fósseis de baratas gigantes Não dá para saber exatamente o tamanho, mas poderia passar facilmente aí de um palmo É, o seu chinelo não ia fazer efeito contra ela Era mais fácil ela pegar seu chinelo e te matar, mano Caraca! Ô louco, ô louco, bicho Ô louco De todos esses insetos, o que me deixou com mais medo é esse daqui que vamos mostrar agora O escorpião gigante marinho Esse carinha podia chegar a 2,5 m de comprimento com presas com mais de 40 cm Você tá doido Esse escorpião era praticamente então do tamanho de um jacaré Segundo os registros fósseis, esses escorpiões pertenciam aos maiores predadores marinhos daquela época Também pelo tamanho, né Naquela época alguns desses gigantes ocupavam o mesmo lugar na cadeia alimentar do que os tubarões brancos modernos Hoje em dia era meio do mesmo é p naquela época eles eram equivalentes aos tubarões Então se você tem medo de tubarão, você vai ter medo desse negócio aí eles poderiam usar seus gigantescos membros dianteiros para tecatar armando como garras para a garras as presas depois começar a destruir tudo e é agarrava e depois esmagavam em estruturas que se pareciam com dentes Parece um tubarão com sei lá, uma armadura, tá ligado Armadura Foram encontrados fósseis desses na Austrália e também na Europa E se a centopeia, né, sem pés hoje em dia já é grande, imaginaquela época Nem se chamava centopeia, se chamava milas Podendo chegar a 2,40 m de comprimento Se liga aí na comparação de um humano do lado desse inseto Meu, olha isso, velho Tá maluco Mas que que você faz para matar um negócio desse Virou amigo Tá com a bomba Eu viro amigo É, se ele não quiser virar amigo com você aí E apesar do seu tamanho, esse animal era muito importante para o ecossistema daquela época, pois seus hábitos alimentares ajudava o solo, pois com as suas interações com plantas e outras criaturas, contribuía para o antigo ecossistema Legal, hein Ó o tamanho, velho É, hoje em dia a centopeia tem 25 cm, tá ligado Aham Aí tem outras maiores com 90 cm Essa aqui tinha 2,5 m Mas esse bicho era do bem Apesar do seu tamanho, consumia apenas plantas assim reciclava o nutriente do solo, tá Mas o que aconteceu então com esses insetos Por que que eles não são tão grandes hoje em dia Primeiro ponto é a queda do oxigênio Com a evolução das plantas e mudanças climáticas, o nível do oxigênio caiu e os insetos gigantes não conseguiram mais sobreviver Coitadinhos Bem feito Outro ponto foi a ascensão dos vertebrados Répteis e anfíbios predadores surgiram e começaram a se alimentar desses insetos gigantes O terceiro fator foi a mudança no ecossistema, pois o mundo sempre está em transformação, favorecendo assim criaturas menores e mais ágeis A tendência é que com o tempo os gigantes vão sumindo, pois eles precisam de mais oxigênio, de mais alimento, de mais coisas para se manterem vivos Mas mesmo assim temos insetos gigantes, podemos dizer hoje em dia Como por exemplo o bicho pau, que pode chegar a 60 cm de comprimento, aquele do vida de inseto, sabe Tem também o besouro Titã da Amazônia que pode medir 16 cm Isso é muito grande para um inseto Imagina a força desse besouro E também, galera, existem várias centopeias gigantes, não daquele tamanho, né Mas que podem até caçar pequenos roedores atualmente Então, da próxima vez que você ver uma barata voadora, pega o seu chinelo, dá uma chinelada e agradeça Pois lembre-se, ela poderia ser muito maior Aí era com raquete de tênis É mesmo assim, ó Com a pá, sabe Com a arma, lança chamas E se você pudesse viajar no tempo, você teria coragem de viajar para essa época e conhecer esses insetos gigantes Ou você viajaria para uma outra época ver outras coisas Deixa aqui nos comentários onde você iria Se curtiu esse vídeo, já se inscreva no canal para não perder as próximas atualizações e também ative o sininho, beleza Porque assim quando sair vídeo novo, você vai receber a notificação Deixou seu like, então vamos ficando por aqui Obrigado pelo carinho, pelo vídeo Até o próximo vídeo, galera Isso tudo, pessoal Valeu,"
