video_id,transcricao
E_OWENsOl5g,Olá tudo bem eu desenvolvi aqui esse calendário aqui para quem deseja ter uma melhor organização na sua nas suas tarefas na sua agenda desenvolver esse calendário aqui e o link para acessar essa planilha está na descrição desse vídeo então se você deseja adquirir essa planilha aqui só acessar o link na descrição do vídeo e saber mais informações Tá ok vou explicar nesse vídeo aqui como que funciona tá então esse aqui é o final de como que fica com o projeto então aqui você vai ver aqui ó que você pode alterar aqui por mês né por ano você vai fazendo as alterações e de acordo com as alterações você vai ver o as tarefas que você tem em cada dia aqui tá mas para tudo isso aqui acontecer é necessário fazer o preenchimento de um banco de dados Ó você vem nesse botão aqui de banco de dados certo e Aqui é onde você preenche as suas tarefas então aqui você tem as datas aí por exemplo eu fiz uma simulação aqui do mês de março certo Aí você coloca por exemplo um cliente se você faz algum acompanhamento de cliente se você não tiver cliente aqui você pode deixar essa coluna vazia Tá mas para quem faz algum acompanhamento de algum cliente você pode estar utilizando isso caso não é só você apagar aí você vai ter aqui a tarefa um né então você imagina que quando você vem aqui no calendário ó ele tem cinco linhas Então essa aqui é a tarefa 1 2 3 4 5 certo então aqui ele tá seguindo Essa ordem Então você lança o dia tarefa e aqui você tem uma opção de colocar sim certo você só tem a opção de sim quando você coloca sim ele ajuda a alterar esse status aqui no final então quando todos os sims de todas as tarefas tiverem confirmado ele vai dar concluído certo então aqui você v aqui ó Nessa essa linha um aqui que é a linha do dia um aí que reunião 1 2 3 4 5 tudo com sim concluído aqui na na linha do que é o dia 2 do TR ele também tá com todos Ó mas se eu tirar um sim daqui olha só o que acontece ele vira parcial então se ele tiver um sim ele fica parcial se não tiver nemhum sim significa que aquela tarefa ou aquela reunião ela não foi concluída então ele fica tudo em aberto então por exemplo aqui ó no dia 3 estão todas em aberto aí se conclui uma eu coloco aqui um sim ele já muda PR parcial Tá ok eu vou tiar esse sim aqui certo para você ver como é que fica aqui na parte superior você pode filtrar por cliente aqui ó certo aqui você pode filtrar por situação concluo em aberto Ou parcial e aqui você pode filtrar por mês certo então se acabou aqui Você lança aqui por exemplo dia 1 do0 e ele vai aparecer a opção de Abril lá para você ó certo de acordo com o preenchimento aqui por ano quando você virar o ano Então esse banco de dados aqui ele vai ser bem grande você vai poder lançar ele pra vida toda aí gerando essas informações na agenda finalizando esse processo aqui você vem aqui em calendário certo e Aqui é onde acontece todo o processo então você vê aqui por exemplo ó dia 1 ele tá 100% concluído o dia do aqui ó ele vem de cima para baixo ele tá aqui um alerta ó parcial significa que uma das tarefas não estão concluídas e o dia 3 ele tem aqui várias situações agendadas porém Tá em aberto então nenhuma foi concluída ainda então a tendência aqui do dia de hoje pra frente Você sempre vai ter tarefas em aberto no dia né que você vai confirmando se aquilo foi concretizado ou não tá ok aí Aqui você pode mudar Ó aqui tá Março Se eu mudar por exemplo para abril vai mudar se eu colocar Janeiro não aparece nada fevereiro não aparece nada porque não tem informação aí em março ele já puxa os dados de Março se eu voltar aqui ó no dia 1 de Março eu vou tirar um uma uma confirmação lá e vamos ver esse status aqui de concluido mudar ó banco de dados eu vou tirar aqui esse sim aqui ó ó ficou parcial vamos lá no calendário veja ele já alterou Tá ok um detalhe importante aqui também ó é a data que eu estou gravando esse vídeo é no dia 11/3 então quando for o dia atual que você tiver abrindo a planilha ele vai ficar aqui de amarelo no caso aqui tá dia 11 tá em amarelo quando for Dia 12 ele vai ele vai ficar Amarelo dia 12 e assim por diante tá ok aí você pode preenchendo aí Aqui tem até o o final do mês aqui tudo certinho Você pode preencher nessas informações Aqui de acordo com o que você precisa E aí fica fácil né para você poder gerenciar as suas tarefas e as suas informações Tá ok então fica aí esse vídeo aí o link para adquirir a planilha está na descrição desse vídeo Tá OK Abraço e até mais
2d0waLuCjzI,Fala galera sejam bem-vindos a mais um vídeo no canal e no vídeo de hoje vou te ensinar você a ter o pacote Office gratuito e atualizado aí no seu computador da maneira oficial tá pessoal da Microsoft oficial Então você vai ter o Word vai ter o Excel vai ter todas essas ferramentas do pacote Office no seu computador de maneira gratuita e oficial beleza e vamos lá não vou Enrolar aqui o vídeo vai ser bem rápido não gosto de enrolar gosto de ser direto ao ponto então prestem bem atenção para vocês não errarem e conseguirem fazer certinho OK e mais uma coisa pessoal antes de começar eu queria pedir para você se inscrever e deixar seu like então se você se inscrever e deixar o like ajuda o canal eu trago mais vídeos de ajudando vocês tá bom então faz o favorzinho aí vai ajudar demais o canal e eu vou trazer sempre mais vídeos te ajudando aí no seu dia a dia e beleza para começar a gente vai vir aqui nessa pasta aqui do seu computador do seu computador você vai clicar aqui e a gente vai vir aqui em este computador pessoal Nesta parte aqui tá bom clica aqui beleza clicamos aqui agora a gente vai vir aqui em disco local C tá bom e a gente vai vir aqui nessa parte vai criar uma nova pasta aqui prestem bem atenção novo pasta e agora vocês vão colocar esse nome aqui na pasta MS espaço Office desse jeitinho que eu tô colocando setup dessa maneira pessoal precisa ser igualzinho tá bom e vamos dar um enter aqui beleza feito isso agora a gente pode diminuir essa parte aqui e vamos entrar no Google pessoal aí no seu Google o que que você vai pesquisar você vai escrever isso aqui que eu vou colocar Office desse jeito aqui customization to é customization mas eu falando assim fica mais fácil PR vocês entenderem tá E vocês vão dar um enter e Ok vai aparecer isso aqui pessoal o que que vocês vão clicar vocês vão vir aqui nessa primeira nesse primeiro site aqui tá este aqui ó não se confundam é nesse aqui e beleza estamos no site Pessoal esse site aqui tá eu vou deixar ele na descrição do vídeo para ficar mais fácil para vocês conseguirem entrar tá vocês já clicam direto já vão cair nesse site assim não tem confusão beleza lembrando pessoal que esse aqui é um site oficial da Microsoft tá ó site oficial de maneira oficial Então vamos fazer tudo certinho aqui comigo para vocês terem aí a versão gratuita do pacote Office beleza OK agora o próximo passo pessoal a gente tá aqui no site tá tudo certo vocês vão ver aqui que ele já vai jogar essa janela aqui para você arquitetura e já tá aqui ó 64 bits e 32 bits Qual que você vai selecionar geralmente Ele já vai reconhecer o seu computador e já vai colocar para você o meu computador é 64 bits então já tá certo só que se você tá com dúvida se o seu computador é 6432 vem aqui em cima tá vem aqui em sistema e vocês vão ver aqui ó que vai aparecer já aqui ó cadê cadê cadê Aqui 64 bits tá vendo o seu vai aparecer aqui tá então fica de olho aí é bem simples para você descobrir é só fazer isso aqui que você vai achar tá bom beleza já sabemos qual que é Nossa arquitetura e agora o que que a gente vai fazer você vai descer aqui embaixo e vai ter essa opção aqui ó selecione o produto Office Suits pessoal prestem bem atenção agora você vai selecionar essa opção aqui Office ltsc essa última aqui vocês estão vendo aqui que para cima tem outras outras opções mas é essa última aqui ó Office ltsc Profissional Plus tá 2024 volume license essa aqui é a versão tá até o momento Essa aqui que vai funcionar Você vai clicar aqui não clique em outro pessoal tem que ser essa aqui ó confira ó olhem bem se você tá clicando na mesma que eu cliquei beleza fez isso desa Aqui para baixo tá e procure por idioma beleza vamos clicar aqui se desar idioma e você vai vir aqui ó com responder com o sistema operacional beleza e agora você vai vir aqui em exportar e agora vai vir aqui em formatos Office Open XML e vai dar um ok aqui e agora você vai aceitar os termos Tá bom se você quiser ler os termos são um pouquinho grandes aí Tá mas e eu vou aceitar aqui que eu já sei quais são os termos beleza aqui você não vai mexer no nome e a gente vai vir aqui em exportar tá pessoal bem aqui E vocês viram que já baixou aqui né né Já tá tudo pronto pra gente utilizar que que você vai fazer agora vamos abrir aqui os downloads e agora eu vou vir aqui ó nessa parte aqui na pastinha pessoal na pasta de downloads do seu computador ó já apareceu aqui ó tá aqui ó configuração eu vou dar um recortar tá Clic com o botão direito aqui vou vir aqui ó em recortar pessoal aqui recortar e agora a gente vai vir aqui no Windows C Lembra daquela pasta que a gente criou Então você vai vir aqui MS off setup e vai dar um control V V Ou seja você vai colar aqui dentro pessoal Ó você vai vir aqui em colar e pronto tá aqui dentro que que a gente vai fazer agora agora a gente vai Minimizar tudo isso aqui e você vai vir aqui novamente no Google e vai colocar assim ó Office depl Opa já errei deployment Tool já tá aparecendo aqui ó essa aqui ó você vai colocar exatamente desse jeito aqui ó Office deployment to e agora a gente vai vir aqui nesse primeiro site tá ó o primeiro site pessoal ó tem que ser esse aqui ó beleza clicamos aqui e vai aparecer este site aqui e agora pessoal a gente vai vir aqui e vai deixar aqui em inglês mesmo tá não mexam aqui nessa parte e vamos vir aqui em download ele já vai baixar bem rápido vamos fazer o mesmo procedimento clicar aqui mostrar numa pasta a gente vai vir aqui em recortar tá ó lá vamos vir aqui em recortar e agora a gente vai volar naquela pasta de novo que a gente tinha entrado aquela hora no Windows C que tá aqui em MS Office setup e vamos colar aqui dentro também e igual a gente fez com aquela ali beleza aí tá colada aqui então vai ficar esses dois arquivos aqui dentro e agora a gente vai clicar neste arquivo aqui vamos com o botão direito novamente e você vai vir aqui nessa opção aqui ó executar como administrador vai clicar aqui ele vai aparecer essa permissão aqui pra gente tá Você pode ler também como eu falei mas tá em inglês se você quiser ler então traduz no Google Tradutor eu não vejo necessidade tá então a gente vai vir aqui ó em clique aqui para aceitar os ter termos da Microsoft Beleza a gente vai vir aqui em continuar E agora vocês viram que abriu essa janela aqui ó stract FS Então você vai fazer o quê mas ele tá pedindo para você selecionar uma pasta para ele extrair os arquivos Então a gente vai vir aqui n computador ó vocês vão vir aqui e vão vir aqui ó Window C tá naquele mesmo lugar que eu mostrei para vocês e agora a gente vai procurar a nossa pastinha MS off setup e aqui a gente vai dar um ok e ó arquivos extraídos com sucesso Vocês estão vendo aqui já apareceu aqui tá vendo ó tá pronto pessoal olha só tá perfeitinho pra gente utilizar e agora prestem bem atenção que essa parte é muito importante a gente pode dar um ok aqui já e agora pessoal Verifica se tem isso aqui ó tem que ter esses quatro arquivos tá dessa maneira que eu ensinei para vocês tem que tá tudo certinho perfeito agora a gente vai fazer o seguinte pode Minimizar isso aqui pode Minimizar isso aqui também e você vai vir aqui no seu pesquisar tá se o seu Windows for 10 ele vai estar aqui pro canto aqui mas você vai digitar aqui ó CMD vai aparecer a prompt de comando do seu computador tá você vai dar um botão com clique direito do seu Mouse aí e vai vir aqui ó executar como administrador clica e vai aparecer isso aqui pessoal prestem bem atenção agora e agora vocês estão vendo que tem aqui um negócio tipo um digitar né você vai selecionar o capslock ativa o capslock no seu notebook no seu computador e coloca c d e barra contra pessoal o que que essa barra contra em vez de ser essa Barrinha assim ó é essa Barrinha do contrário assim e agora você vai dar um enter e de novo você vai colocar CD e espaço c minúsculo dois pontos Barra do contra de novo a barra inversa que a gente colocou lá em cima MS maiúsculo com o capslock ativado espaço Office com o maiúsculo desse jeito espaço setup com S maiúsculo igual sabe o quê aquela pasta que a gente tinha criado se você criou diferente pessoal tem que ser igual tá ó a pasta que eu criei vamos vir aqui V mostrar para vocês ó ela tá exatamente assim ó vocês estão vendo aqui ó tá MS espaço Office com maiúsculo e s com s maiúsculo Então tem que ser exatamente igual e agora a gente aperta Enter e agora você vai escrever setup novamente com S maiúsculo pon exe barra configure exatamente assim pessoal do jeito que eu tô escrevendo configure espaço configuração do mesmo jeitinho que tá aquele arquivo lá dentro da pasta tá então vou mostrar para vocês de novo ó configuração Ponto X ml e agora a gente vai dar um enter e olha só vai aparecer uma janelinha de instalação vai carregar as tela de carregamento do Office e pronto ele vai ser instalado no seu computador Bom vou ficando por aqui espero que esse vídeo tenha te ajudado deixa seu like comenta aí se eu conseguir te ajudar vou ficar muito agradecido se você puder deixar o seu comentário falando se deu certo ou não vou ficando por aqui e até uma próxima pessoal fiquem bem
hPe7bA2s8XI,a China pretende construir uma base secreta no lado obscuro da lua não só a China como também outros países como por exemplo a Rússia então será que uma nova era da corrida espacial esteja vindo por aí Qual será o primeiro país a construir uma base lá na lua bom é isso e um pouco mais que vamos ver no vídeo de hoje a base no lado escuro da lua mas antes se inscreva no canal se não é inscrito e como de costume vai deixando logo o seu joinha yeah Fala galera beleza bom eu sou o Lucas lunático Marques o programa do Daniel base bolo e foi entre os anos de 1955 a 1975 que os Estados Unidos ganharam a corrida espacial contra a União Soviética naquela época os Estados Unidos levaram New Armstrong para a lua em 1969 Então foi fincada uma bandeira na lua mostrando para o mundo onde eles haviam chegado e isso fez com que os americanos ganhassem dos soviéticos que tinham os primeiros a levar uma pessoa no espaço em 1961 com Yuri Gagarin mas ainda não tinham chegado até a lua e depois então que tudo isso aconteceu anos depois Parece que agora está acontecendo mais uma outra corrida espacial dessa vez para ver quem constrói primeiro uma base na lua isso porque muitos outros países no mundo estão explorando o espaço como por exemplo a Rússia a Índia e a China e um desses projetos que está chamando a atenção do mundo inteiro é um projeto lunar que tende a criar uma base permanente na lua uma base que vai servir como ponto de acesso para explorar outros lugares do espaço lugares principalmente como Marte e em 2021 esse objetivo então ficou declarado para todos depois que a China e a Rússia fizeram um acordo para fazer uma estação de pesquisa internacional só que não aqui na terra galera lá no Lado Oculto da Lua os chineses junto com os russos querem construir uma chamada ilrs uma sigla em inglês que significa Estação internacional de pesquisa lunar e essa base serviria para abrigar vários experimentos científicos com potencial para se tornar uma base de apoio para a exploração espacial até porque essa base não é uma única sala uma casinha e sim um complexo de instalações segundo a divulgação outra coisa interessante é que essa base não precisaria ser operada por um ser humano pois a intenção é que ela seja controlada e habitada por robôs e hovers de exploração e segundo informações se em outros países quiserem entrar também para ajudar eles estão abertos para essa parceria e inclusive Eles já até escolheram qual seria o local da construção dessa base no caso no Polo Sul da lua que é mais conhecido aqui na terra como o lado obscuro da lua o lado que fica o oposto da terra Aí eu te pergunto por que que eles construir uma base no lado obscuro da lua bens contidinho porque que eles querem esconder é aí que quem gosta de Teoria da Conspiração começa a ficar maluco mas na verdade a resposta não tem nada de mistério não tem nada demais essa região foi escolhida porque ela é rica em recursos naturais como ferro e outros materiais menos conhecidos como por exemplo o piroxênio então não tem nada de segredo eles vão construir a base ali para aproveitar melhor a exploração e os estudos mas por enquanto ainda não existe nenhuma data de lançamento desse projeto porém o plano deve começar em 2025 a partir então de 2025 eles vão escolher os países que vão participar dessa construção mas esse parceiros né no caso e também o local exato tipo a gente falou que vai ser lá no lado obscuro Mas eles têm que definir o local exato né onde ela vai ficar ali as coordenadas e tudo mais e a construção deve acontecer entre 2026 e 2035 pois segundo o planejamento a partir de 2036 a base lunar deve entrar em operação mas antes mesmo disso tudo acontecer antes mesmo de chegar a 2036 a China já quer vários testes lá na lua inclusive em 2030 Eles já querem lançar vários robôs para lá para testar os robôs e coisas do tipo e depois então de 2036 quando Muito provavelmente a base já estará pronta eles pretendem então lançar uma missão com os seres humanos que pode durar até 2045 e para realizar todos esses objetivos incluindo a construção da base na lua os chineses estão apostando nesse programa espacial Shang e o programa xangie é um programa chinês de exploração lunar que teve seu início lá em 2004 e 2007 ele atingiu seu primeiro grande feito quando achando em um entrou com sucesso na orbita lunar depois em 2013 com a missão xang e três eles realizaram o primeiro pouso suave E também o envio de um Rover para a superfície lunar já em 2018 com Xande quatro eles realizaram o pouso de uma sonda no lado oculto da lua lá no Polo Sul e em 2020 a sonda sangue i5 foi a responsável por descobrir um novo mineral na lua essa sonda pousou na lua em dezembro de 2020 e retornou a terra duas semanas depois com 1700 g de amostras lunares e a partir então dos estudos feitos com essas amostras os cientistas chineses descobriram o chamado xenzite y o sexto mineral inédito já encontrado top da hora imagina o que deve ter pelo universo a fora Ele é basicamente o cristal transparente incolor que foi retirado de um Basalto lunar em uma região conhecida como oceanos protelaram ou oceanos de tempestades e aí recentemente o governo chinês aprovou o envio de três sondas robóticas para a lua achei 7 e 8 que que será que eles vão descobrir agora e essa sondas devem pousar na lua se elas não quebrarem né entre os próximos 10 anos e segundo que é diretor da Agência Espacial chinesa achei que é seis Já está quase pronta e seu objetivo vai ser Recolher mais amostras da superfície trazendo assim mais dessas amostras para a terra assim como a Sheng A5 fez já no caso da Chang 7 o seu objetivo é estudar o Polo Sul da Lua para sempre recolher o máximo de informação possível sobre aquela área que vai ser o local onde vai ser construída a base lunar e por fim a Sheng é oito deve testar tecnologias de impressão 3D e o uso de recursos lunares e apesar dos chineses não considerarem isso como uma nova corrida espacial o atual administrador da Nasa Bill Nelson está preocupado que os chineses ocupem a lua inclusive os americanos já tem uma carta na manga para isso no caso com o programa chamado Artemis que é um programa desenvolvido pela NASA que pretende levar de volta ao ser humano para a lua Esse programa é considerado como o irmão gêmeo do programa Apolo que foi o programa responsável por levar o primeiro homem a lua em 1969 e Artemis para quem não sabe é uma deusa grega irmã gêmea do Deus Apolo e é por isso que o programa recebeu esse nome e esse programa então tem como objetivo aprofundar as pesquisas sobre o nosso satélite natural o nosso sistema solar e também aumentar o tempo de permanência dos astronautas no espaço se vocês ficaram curiosos e querem saber mais sobre esse projeto Artemis deixe o seu like agora envie esse vídeo para outra pessoa para pegar mais views possíveis tá bom e se gostou também do vídeo que fizemos a respeito da base lunar que deve acontecer nos próximos anos deixa o seu like aqui embaixo beleza galera Qual país você acha que vai ser o primeiro a construir a base na lua Estados Unidos Rússia ou China ou índia isso não dá para saber agora mas se você aí quer saber mais coisas Tem alguns vídeos aqui na tela clica naquele que você acha ela interessante e assista nos vemos em breve Então galera isso tudo pessoal valeu [Música] [Música]
wbVPvVIepXw,"[Música] E o que o novo papa gostava de fazer nas horas vagas em Roma O correspondente Rodrigo Carvalho descobriu os restaurantes e os pratos preferidos de Leão 14 Apreciador da culinária internacional, ele também gosta de [Aplausos] [Música] malhar Patam [Música] O novo papa sabe viver Essa é a pizzaria favorita de Robert Prevusto aqui em Roma, bem perto do Vaticampo É tudo que se quer no sábado à noite Mas fiquem tranquilos, o novo papa não é um homem assim tão óbvio, gosta do mundo Nesse restaurante chinês, o cardeal prevolso gostava era de carne de porco Essa aqui com pimentão, cenoura e molho agridce Mas ele variava Com frequência pedia também esse camarão com legumes e esse pato com molho de laranja A gente ficou muito feliz quando viu que ele era o novo papa Nos demos conta de que era o nosso cliente quando vimos a lista com as fotos dos cardiais Espero que ele lembre da gente e volte ele seria meu convidado Em frente ao chinês fica o café da Pap, onde prevo fazia o que se espera aqui em Roma depois do almoço O novo Papa viveu aqui na cidade em diferentes fases da vida Aos 27, estudou direito canônico na Pontifícia Universidade de São Tomás de Aquimo Mais recentemente, em 2023, veio morar aqui de novo depois que foi nomeado cardeal pelo Papa Francisco O Papa, portanto, tem intimidade com Roma Esse muro aqui cerca e delimita a área do Vaticano É daqui para lá, daqui para cá, Roma Mas o então cardeal não circulava aqui só para ir para restaurante Ele precisava compensar, né Nessa rua aqui fica a academia onde o novo papa malhava A gente vai ler agora O papa ainda não cancelou a matrícula Alguns funcionários souberam que prevo será cardeal por terceiros Ele, muito humilde, nunca falou quem era e cumprimentava todo mundo todos os dias, sempre com sorriso Alessandro espera que o agora Papa continue se cuidando e se ele aparecer aqui qualquer dia desses, eu vou ter que usar o nosso desfibrilador Eu perguntei pro professor da academia que acompanhava o cardeal nos exercícios se leão é forte Le era forte Ele disse que sim e que não só pagava a academia, vinha mesmo e com frequência Ele tá dizendo, gente, que o Papa pegava 25 kg com esse aparelho aqui para costas É pesado isso É pesado Para um senhor de 69 anos significa que ele tá com a condição física boa O cardeal ainda jogava tênis nessa quadra com vista pra Basílica de São Pedro Chegou a falar que foi praticando o esporte que desenvolveu a virtude da paciência Mas claro, o novo papa também frequentava igreja em Roma Messa celebrou no final de março uma missa importante Quem abriu essa missa e antes recebeu então cardeal nessa sala foi esse pároco italiano Ele fez uma homilia muito, muito bonita e muito profunda Um discurso profundo, mas ao mesmo tempo compreendido por todos O Thago também tava na missa No vídeo Thiago aparece depois da comunhão ajudando no momento em que o então cardeal lava as mãos Como uma mão lava a outra, a gente convidou o Thiago para comer na pizzaria favorita do Papa Imagina se ele ia falar mal Nota 10 Quando eu escutei aquele anúncio, o nome dele, pensei imediatamente, eu estive com ele Depois, em seguida, eu pensei, eu preciso do vídeo Tem o rito ali da purificação das mãos do cardeal e nós fomos lá para poder fazer a purificação Então, é realmente um motivo de muita felicidade, porque na verdade acho que poucos esperavam, né, que seria a pessoa dele Enquanto isso, a cidade de Albano, na província de Roma, tá numa mistura de sentimentos Tava tudo pronto Amanhã o então cardeal previsto tomaria posse como titular da catedral da cidade Ia ser uma festa com procissão e tudo Agora sabe-se lá quando ele vem O padre brincou Fomos pro final de uma longa fila Aos poucos, Leão 14 vai ganhando as igrejas de Roma Saiu o quadro que dizia sede vacante quando a igreja tá sem papa e entrou o brasão do novo pontífice O Juliana é brasileiro, 34 anos só, o pároco mais jovem de Roma O desafio dele vai ser, sem dúvida nenhuma, essa questão da guerra, da todas as novidades do mundo, né A digitalização, os novos meios de comunicação, a novidade que o mundo tá trazendo, mas também a unidade da igreja [Música]"
