video_id,transcricao
F_dUx77uwuc,você já quis ter super poderes tipo ficar invisível poder voar ter super forças ou coisas do tipo estamos perguntando isso porque no vídeo de hoje nós vamos mostrar para vocês alguns insetos Super Poderosos Então se inscreva no canal se ainda não é inscrito e como de costume vai deixando logo o seu joinha yeah deixa o joinha logo no começo do vídeo para você não esquecer beleza e agora então vamos para o vídeo puxa a vinheta Fala galera beleza bom eu sou o Lucas super poderoso Marques Opa é um inseto molo e no mundo todo existe um total de mais ou menos 10 quintilhões de insetos esse número gigante que tá na tela aí não sei nem o que que é é um número 10 seguido de 18 zeros é muita coisa divididos em 30 milhões de espécies e é claro que no meio de tantas espécies assim algumas seriam bem diferentes e até mesmo tendo super poderes como por exemplo a pulga que pode saltar 150 vezes o seu tamanho um outro super inseto que existe também é o bracon hebetor esse inseto galera possui Uma Incrível resistência à radiação esse Inseto é uma vespa minúscula que é vendida para controlar pestes em plantações sem precisar usar inseticidas isso porque galera esse inseto praticamente é um parasita de larvas alimentando e destruindo todas as larvas presentes nas plantações Mas esse não é o Super Poder do bracon e sim a sua resistência à radiação já que esse inseto pode suportar até 180000 HS 180000 HS galera é muita coisa um ser humano an sem equipamentos e coisas do tipo só consegue sobreviver até 1000 HS e esse bichinho chega a 180000 ou seja se algo nuclear destruir o mundo todo esses insetos podem sobreviver outro inseto bastante poderoso e forte conhecido como ont pagus Taurus ele é considerado o inseto mais forte do mundo esse inseto se alimenta principalmente de fezes e é extremamente agressivo E o que mais chama a atenção nele é justamente a sua enorme força já que ele é capaz de puxar 1141 vezes o peso do próprio corpo para vocês terem uma noção Vamos dar um exemplo Vamos colocar um ser humano para poder realizar a mesma coisa que esse besouro faz vamos calcular com um humano médio de 68 kg um humano médio de 68 kg teria que conseguir puxar 77 toneladas para conseguir se igualar a força que o Besouro tem e esses besouros são conhecidos por rolar aquelas bolas de estercos que são bem mais pesadas do que eles e para quem não sabe esses estercos que eles rolam servem como alimentos ou também como um lugar para eles se acasalarem credo credo mesmo você acha que é melhor a gente falar isso não não né Deixa quieto as fêmeas cavam buracos dentro da feses para eles entrarem e se acasalar lá dentro Ai credo outro inseto bastante poderoso é o Besouro da folha que veio diretamente lá do Naruto né da Aldeia das Folhas esses insetos pertencem à família dos kisom milid Mas eles são conhecidos mesmos como leaf Beatles ou o Besouro da folha essa família inclui mais de 35000 espécies e algumas dessas espéces tem uma técnica de defesa bastante interessante e também bem inteligente e um pouco nojenta para não serem detectadas por outros predadores olha só o que esses insetos fazem você faria o mesmo as larvas desses bouros se cobrem com suas fezes para não ser detectadas por outros predadores Imagina você tá na rua aí passa uma moto dois caras em cima da moto você começa a cagar na mão e passar no corpo Ah no carro não vai te assaltar cara loque talvez você deve estar se perguntando Poxa Lucas e Dany mas se cobrir de cocô é um super poder na vida de inseto onde você pode estar Correndo Perigo a qualquer momento é uma forma inteligente para eles sobreviverem mas esse aqui é mais interessante tá bom vamos ess vamos sair do cocô né mano um rola cocô o outro já COB de cocô agora então vamos falar do Besouro bombardeiro esses besouros podem ser encontrados em praticamente todos os continentes menos na Antártida por causa do frio extremo eles têm hábitos noturnos e vivem a maior parte do tempo escondidos eles são bem pequenininhos tem apenas 2 cm5 de tamanho Mas se forem atacados por outros insetos eles vão sair ganhando isso porque eles têm um tipo de superpoder incrível eles conseguem disparar um jato de soluções químicas forte o suficiente para queimar o seu adversário e esse jato que ele dispara né como se fosse uma arma além de ser tóxico é bastante quente podendo chegar a 100º c isso porque dentro do abdôme desse bourin tem duas glândulas com diferentes substâncias químicas agora eu lembrei tipo um cientista tá ligado ele pega uma substância com outra e mistura e p na primeira a gente tem peróxido de hidrogênio e na segunda temos hidroquinona essas duas substâncias paradas não tem problema nenhum mas quando elas se juntam O resultado é uma reação química Explosiva então assim que esse bisouro se sente ameaçado seus músculos se comprimem ele mistura em seu corpo as duas substâncias químicas explosivas e solta direto no inimigo como se fosse um jato de spray fervente bem rápido em sequência um atrás do outro e esse ataque pode chegar a uma distância de 10 cm podendo chegar a uma velocidade de 24 m/s só que como é em centímetro é muito rápido outro super poder que um outro inseto tem é conseguir sobreviver a temperaturas baixíssimas estamos falando de uma espécie de mosquito da família kiron midai esses insetos vivem a maior parte de suas vidas em forma de larvas e eles galera adoram o inverno ou pelo menos os lugares frios e esses mosquitinhos do frio galera não picam seres humanos diferente dos mosquitos do calor né porque quando o calor chega vem junto também os mosquitos as mosquit os pernilongos Esses mosquitos do Gelo se alimentam de algas e micróbios Aí sim não vem Sugar meu sangue não que eu não gosto luzinha com Vagalume Luluzinha ten maior medo de meu vagalum à noite maior susta acho que é um ET no começo Como assim mano pô o bagulho uma luz ind na sua direção você tinha medo de vagalume não tenho medo mas é um bicho meio esquisito sabe que eu fazia quando eu jogava bola ia botava nas eu pegava e esfregava na roupa e ficava tudo ficava colorido porque eu né estourava a bundinha dele e ficava que o material coloridinho fluorescente Coitadinho você sabia que os vagalumes eles se comunicam por códigos através da das luzes os vagalumes conseguem criar uma comunicação entre eles utilizando apenas da luz que eles emitem é claro galera que os seres humanos não falam Vagalumes né ninguém conseguiu ainda descobrir o que eles estão falando né de um vagalume pro outro e ainda é um código morse e Vagalumes né É exatamente porque tá lá só piscando mas sim eles se comunicam usando as suas luzes e geralmente eles fazem isso durante o acasalamento né para falar assim venha venha que eu tô pronto aí começa a baladinha e podemos dizer é claro que isso é um super poder você consegue comun ficar com outra pessoa sem ser por celular por telepatia ou piscando o olho assim ó só com luz vamos falar que você tá doido né E esse galera foi o vídeo de hoje Esperamos que vocês tenham gostado se não deixou o joinha até agora não saia sem deixar o Polegar pra cima beleza não custa nada só descer logar com a sua conta clicar deixar o like E é só sucesso escolha um outro vídeo aqui ó que você ainda não assistiu que tá aparecendo aqui na tela tem três beleza Ou então aguarde o vídeo que vai sair amanhã nos vemos no próximo vídeo Então pessoal isso tudo pessoal P valeu l [Música]
arJVNwjhmRY,"qual é a verdadeira natureza do Universo para ter uma resposta os humanos criam histórias para descrever o mundo testamos essas histórias e aprendemos o que guardar e o que jogar fora mas quanto mais aprendemos mais complicadas e estranhas nossas histórias se tornam tanto que algumas dessas histórias são realmente difíceis de serem compreendidas é o caso da teoria das cordas uma história famosa controversa e muitas vezes compreendida sobre a natureza de tudo por que criamos essa teoria e será que ela está correta ou é só uma ideia que devemos [Música] abandonar para entender a natureza da realidade olhamos as coisas de perto e nos admiramos paisagens maravilhosas na poeira zoológicos de criaturas bizarras complexos robôs de proteína todos feitos de estruturas de moléculas com constituídas por incontáveis coisas ainda menores átomos nós pensávamos que eles eram a camada final da realidade mas ao colidir mos com muita força descobrimos coisas que já não podem ser divididas partículas elementares mas aí tivemos um problema Elas são tão pequenas que já não conseguimos mais vê-las Pense nisso o que é ver para ver algo precisamos de luz uma onda eletromagnética essa onda atinge a superfície da coisa e é refletida de lá para dentro do seu olho a onda carrega informações do objeto que seu cérebro usa para criar uma imagem então você não pode ver uma coisa sem interagir com ela ver é de certa forma tocar é um processo ativo não passivo isso normalmente não é um problema mas as partículas são muito muito muito pequenas tanto que as ondas eletromagnéticas que usamos para ver são grandes demais para tocá-las a luz visível apenas passa sobre elas é possível resolver isso criando ondas eletromagnéticas com comprimentos de onda cada vez menores mas mais comprimentos de onda é mais energia e se uma onda que tem muita energia toca uma partícula ela é alterada então ao ver uma partícula nós a modificamos assim não podemos medir partículas elementares com precisão este fato é tão importante que tem um nome o princípio da incerteza de Heisenberg a base de toda a física quântica então como é uma partícula Qual é a sua natureza não sabemos se olharmos atentamente podemos ver uma esfera de influência Bassa mas não as partículas em si só sabemos que elas existem mas se é assim como podemos fazer ciência com elas nós fizemos o que os humanos fazem e inventamos uma nova história uma ficção matemática a história da partícula pontual decidimos fingir que uma partícula é um ponto no espaço elétrons são um ponto com uma certa carga elétrica e uma certa massa todos indistinguíveis uns dos outros assim os físicos poderiam defini-los e calcular todas as suas interações é a chamada teoria quântica de Campos que resolveu muitos problemas o modelo padrão da física de partículas é baseado nela que prevê corretamente muitas coisas algumas propriedades quânticas do elétron por exemplo foram testadas e tem precisão de até 0,00 2% Então embora as partículas não sejam realmente pontos tratá-las como se fossem nos D um bom retrato do universo essa ideia não só fez a ciência avançar mas também nos levou a muitas das tecnologias que usamos hoje mas há um enorme problema a gravidade em mecânica quântica todas as forças físicas são transportadas por certas partículas segundo a relatividade geral de Einstein a gravidade não é uma força como as outras no universo se o universo é uma Peça as partículas são os atores mas a gravidade é o palco simplificando a gravidade é uma teoria da geometria a geometria do próprio espaço-tempo de distâncias que precisamos descrever com absoluta precisão se não há como medir com Rigor as coisas no mundo quântico a história da gravidade não funciona com a da física quântica quando os físicos t tentaram adicionar gravidade à história inventando uma nova partícula a matemática quebrou e este é um grande problema Se pudéssemos casar gravidade física quântica e modelo padrão teríamos a teoria de tudo então cientistas inventaram uma nova história Eles perguntaram o que é mais complexo do que um ponto uma linha ou uma corda assim nasceu a Teoria das Cordas o que faz essa teoria tão elegante é ela descrever partículas Element diferentes como os modos de uma corda vibrar uma corda de violino dá notas variadas ao vibrar Diferentemente e uma corda pode dar partículas diferentes e mais importante ainda ela inclui a gravidade a Teoria das Cordas unia todas as forças fundamentais do universo isso causou enorme entusiasmo e empolgação a Teoria das Cordas rapidamente virou uma possível teoria de tudo muito da matemática para uma teoria das cordas consistente não funciona em um universo com três dimensões espaciais e uma temporal a Teoria das Cordas requer 10 dimensões assim os teóricos fizeram seus cálculos em universos modelo e então tentaram retirar as seis dimensões adicionais e descrever o nosso universo Até agora ninguém conseguiu e nada previsto pela teoria das cordas foi comprovado em experimentos logo a Teoria das Cordas não revelou a natureza do universo pode-se argumentar que portanto a Teoria das Cordas não é útil a ciência é feita de experiências e previsões Se não conseguirmos fazer isso por que considerar cordas a questão é Como usamos a teoria a física é baseada na matemática 2 + 2 são 4 é a verdade Não importa sua opinião e a matemática funciona na teoria das cordas é por isso que a teoria das cordas ainda é útil Imagine que você quer construir um navio mas só tem o projeto para um pequeno barco aremo Há muitas diferenças o motor os materiais a escala mas ambos TM algo fundamental em comum são coisas que flutuam então estudar projetos de barcos a Remo pode trazer algo útil sobre como construir um navio com a Teoria das Cordas tentamos responder antigas questões sobre gravidade quântica tais como como os buracos negros funcionam ou o paradoxo da informação a Teoria das Cordas pode apontar a direção vista assim a Teoria das Cordas se torna uma ferramenta preciosa para os físicos teóricos ajudando-os a descobrir novos aspectos do mundo quântico e algumas matemáticas TZ a hisa da teoria das cordas não seja a teoria de tudo mas assim como a história da partícula pont também muito útil Ainda não sabemos Qual é a verdadeir natureza da realidade vamos continuar inventando histórias para tentar descobrir até que um dia quem sabe consigamos este vídeo foi patrocinado por você a produção de nossos vídeos leva muitas horas e se quiser nos apoiar para fazermos ainda mais pode contribuir pelo site patreon e ganhar seu próprio pássaro kutesa ou comprar algum item da nossa loja Nós criamos produtos de alta qualidade com temas científicos para despertar sua curiosidade pela ciência natureza e pela vida o mesmo esforço e amor que colocamos em nossos vídeos também colocamos na criação de nossos pôsteres cadernos roupas e acessórios e a cada compra você apoia diretamente o que fazemos neste canal mas por favor não se sinto obrigado a fazer isso assistir e compartilhar Nossos Vídeos Já Nos ajuda muito e somos gratos por você se importar com o que fazemos aqui Obrigada por [Música] assistir"
suxIV1zNt9A,eu vou me entregar nem minha própria equipe nem ninguém jamais entendeu por eu fico do lado de fora do banco alguns acharam que era por covard que se alguma coisa desse errado euia do lado de fora eles não mas eu Prometi a mim mesmo que se o time caísse eu cairia com eles eu me dei conta de que você é um herói a gente pode beber e fazer uma [ __ ] zona porque você tá do outro lado segurando a corda não importa o qu ruim as coisas fiquem mesmo que nos coloquem de joelho mesmo que pareça que não tem esperança que estamos quase mortos seguimos acreditando porque sabemos que sempre teremos o professor meu Deus do cé C os mercados financeiros funcionam como uma grande casa de apost ququ bola de Nova Dogo mes noso Dea naal SA o que isso significa todo ess efeito domin é o respaldo de crédito de um país é a solvência a garantia você entende eu entendo senhor Mario eu entendo o sistema ele foi projetado para isso automaticamente e é previsível previsível previsível é um túnel porque você entra por um lado e sai pelo outro isso é previsível mas essa [ __ ] aqui não tá na nossa mão não dver por favor não ele não pode brincar com a nossa vida assim eu vou te falar uma coisa Professor isso não vai funcionar é assim atentos como uma coruja é assim tensos alertas porque eles vão te ferrar assim que se abaixar a guarda porque Qualquer filho da [ __ ] que vai est lá esse sim esse sim vai est todo dia em Alerta ele vai pegar a gente assim tá tudo bem que a gente estamos aqui todos ajoelhados com a [ __ ] de fuzil na nuca por seguimos o maluco nas últimas horas eu perdi duas pessoas muito importantes não pro plano não não pro roubo não importantes para mim PR minha vida pessoal e eu não vou deixar que ninguém mais caia você acha que sei o que uma crise financeira e fiar país num buraco e me chantagear pessoalmente com isso mas notícias porque eu tenho o apoio do Banco Central europeu para injetar liquidez ou comprar dívidas não temos o apoio do Banco Central europeu Isso quer dizer o qu você não entendeu tamanho o que você acredita se o fim da partida a realidade é só o começo dela eles vão nos deixar quebrar Então esse é o seu último quezinho de mágica 90 toneladas de ouro por aí dançando graciosamente Mas você está certo sobre uma coisa você vive a sua vida como se fosse um tipo de nerd com seus óculos seus origames eu não sei mais como eu posso ganhar mas a realidade a realidade é que você entra no banco com a segurança de quem vai fazer uma queda de braço com o próprio estado você é seu próprio número de ilusionismo Talvez nós dois tenhamos que perder o que é o ouro de um país a sua riqueza não é uma ilusão os lingotes que vieram nesses caminhões são de lat su ap Coronel é hora de reconhecer isso é um cheque [Música] M durante a operação e após forte resistência foram abatidos os seguintes assaltantes [Música] ninguém persegue uma pessoa morta Coronel o ouro de verdade é o nosso refém se não quiser que o maior segredo de estado seja revelado essa perseguição termina aqui e agora para sempre nem tudo foi do jeito que a gente queria não estamos todos mas bom conseguimos alguma coisa certeza que ele vai te dar sua parte Claro é um assunto de família [Música]
UlY2deWLyw0,ser campeão exige sacrifício vou ter que te tirar do banco é isso tem que ser você você é valioso como o treinador mas é indispensável como olheiro acontece que eu não quero mais ficar na rua aliás eu nunca quis ficar na rua me consegue a peça que tá faltando e você volta pra Equipe técnica Como é que é o nome do grandão ali eu não sei não n ess aí o ele é uma lenda Qual é o seu nome rapaz b b Cruz onde você joga B Cruz nenhum lugar trabalho com não por muito tempo tá me ligando para falar de você existem 450 jogadores na NBA mais 100 esperando para serem escalados o meu trabalho é encontrar os outros bons jogadores pelo mundo eu sou muito bom no que eu faço eu vou fazer umas ligações para poder ver você jogando com os caras do seu nível amanhã ten que trabalhar Qual é a sua idade 22 idade no basquete é igual idade de cachorro se a gente vai entrar nessa isso vai ter que acontecer agora olha o cara aí o Cruz é impr lateral o cara acertou 44 50 o cara é incrível Você viu o treino é claro que eu vi o cara impressionante mas tem outras questões caráter mentalidade jogar dentro de um sistema tô parecendo você agora vin Esse cara é a nova aberração ele é um unicórnio ele é uma criatura mítica presta atenção faz 8 anos que o garoto não joga basquete de quadra é existe um motivo para isso vamos ver o que ele consegue fazer na D League você que vai jogar na D League [ __ ] presta atenção vin ninguém sabe do cara você vai ver esse cara você vai surtar vai por mim você tem que ver ele ao vivo isso não vai rolar eu sou valioso não é isso Você falou para eu encontrar peça que tava faltando Se eu quisesse voltar pro banco então aqui tô eu entregando ele de graça e não vai rolar eu te pago para encontrar jogadores Não Para me dizer o que fazer com eles A então B esse aqui é o Vince mar oproprietário do sixers mas ele basicamente administro o time Ah sim bo cruz com certeza ouvimos muito sobre você do Stanley é claro Me desculpe mas eu tinha que trazer ele é você vai ver por ele arremessa de qualquer lugar fica na cola dele não deixa ele gostar de fazer cesto não não deixa ele pegar em Malo tá ele tá aqui para se exibir Vamos dar um show PR essa galera beleza se liga papo reto você é autoro e eu o filha da [ __ ] de capa que faz seu rabo gigante correr por aí sacou vem que eu vou te colocar para dançar consegue parar hum vai ter que pagar a conta do espanhol sten Eu Não Tô interessado tá na hora de voltar pra estrada e procurar mais eu nunca pedi para você pagar a conta dele e eu não tô interessado em trabalhar para um [ __ ] presunçoso e nascido em berço de ouro Vai pra [ __ ] que te pariu e [ __ ] seus hotéis cinco estrelas eu me demito volto para casa amanhã é isso que você quer fazer você veio até aqui você teve um dia ruim e já tá pronto para desistir você ama esse esporte ama com todas as suas forças porque se você não ama nem vamos nos incomodar não vamos abrir essa porta porque eles vão bater na nossa cara eu amo esse esporte eu vivo de verdade esse esporte e tem milhares de caras esperando lá fora que são obsecado por esse esporte obsessão ganha do talento todas as vezes você tem todo o talento do mundo mas vem cá V você é obsecado é só nisso que você pensa vamos encarar é você contra você lá fora quando você entra na quadra você tem que pensar eu sou o melhor jogador que existe não tô nem aí se o Lebron vai jogar então Deixa perguntar de novo você ama esse esporte amo tem algum gatinho recém-nascido ronronando aqui não não tô te ouvindo você quer jogar na NBA quero Então vamos fazer acontecer nunca desista ô estrelas não carregam as próprias malas não deixa que eu cuido disso mas amanhã eles vão observar você cada movimento que fizer a câmera vai est em você e não tem a ver só como você joga não tem outras coisas em jogo mais importante do que fazer uma cesta é como você se comporta errando uma cesta a coisa vai dar errado e daí você lidou com adversidades a vida inteira 22 T te sacando hein a depois que a gente humilhar você devia ir treinar futebol futebol é ruim he Me mudo PR Espanha e dou Mazinho com a sua mãe Isso não funciona mais Ah eu achei que tinha pegado você bom te ver filho seja agressivo hoje joga firme tá não fala para ninguém que eu tô torcendo para você não
qVHPy7Np9rE,[Music] we decided to conduct an experiment and created two absolutely identical playrooms one was empty and there was a child in the other we invited children and gave them the opportunity to choose which room to play [Music] in the process of growing up children's opinions are influenced by society and their parents their perception of the world depends on adults [Music] as children get older it becomes more difficult for them not to notice that all people are different [Music] [Music] as for little kids they do not see the difference between children with special needs and those without [Music] [Applause] [Music] is [Music] this child made the decision to be part of an inclusive community but the world she ends up living in depends on you teach your children what they've taught [Music] you you
